,reviewId,userName,userImage,content,score,thumbsUpCount,reviewCreatedVersion,at,replyContent,repliedAt,appVersion
0,7c89e47a-3752-4f6e-9bbe-f484d94572cb,Faiz Huwaidi,https://play-lh.googleusercontent.com/a-/ALV-UjVNOXb8ct1wPKoFQYhlPvjOyuoZOaPr4CYY9U7N9pPjIGldOc0,Lemot banget ngirim kode OTP nya ajg,1,0,1.4.0,2024-09-23 12:47:06,,,1.4.0
1,23d68ef1-de14-4561-88d0-1bc79b290a06,Surya Kusuma,https://play-lh.googleusercontent.com/a-/ALV-UjXQoFEjb2FRlXKVhmm98Gk3a-L3rC5fZ37yfFVdwcSOL1n0v9d7,"Daftar pajak email aktivasi sudah, ehh pas nerima kode otp no hp ngga muncul udah 4jam nungguin trus dan ulang ulang di coba tetap sama tidak ada otp hadeh memperuslit aja",1,0,1.4.0,2024-09-23 11:29:20,,,1.4.0
2,4fe534e8-e648-49ab-9aa7-b051b8d1c26c,Askar Aska,https://play-lh.googleusercontent.com/a-/ALV-UjVmkfcOLbkR8PPikZ1xe_LfWc3vt6EcoobqjriTaMVDgQkJrjoJ,"Pas Nunggu Kode OTP nya emng GK lama,TPI GK tauu knp pas mau klik daptarr salahh Mulu,Mau daptar juga Mlah nglag. mohon lebih diperbaiki lgi",3,0,1.4.0,2024-09-22 23:26:55,,,1.4.0
3,fa12c7bd-9a4c-471c-bb9e-d54a4a3f85f9,azam Zam,https://play-lh.googleusercontent.com/a-/ALV-UjVtXZ4E5Qchj0ZNsq3yk5ir1O2eLTP748lbzZVj4m_BBDTQq-c,Sangat cocok untuk melihat pajak saya,5,0,1.4.0,2024-09-22 13:31:47,,,1.4.0
4,5e776387-89da-429c-9c30-4d0aef6cf603,Rendi Renaldi,https://play-lh.googleusercontent.com/a/ACg8ocJ3ovk-mRwI5fq3pa216FrJxfFki4UpzMSRnTeof1STVEOQzw=mo,ngabisin pulsa doang,1,0,1.4.0,2024-09-22 00:08:03,,,1.4.0
5,2ff3c164-47bb-4f0d-ace2-9928681f18f8,Riding Raya (Milohong),https://play-lh.googleusercontent.com/a-/ALV-UjXOiz60f7VviY7PqeADJ5iFySloUhWVn-ivt2BHLt2JECI4rwv_,Saya udah muter-muter buka aplikasi maupun di web tetap gak bisa. Katanya akun di blokir padahal baru saja di buat. Ini gimana ceritanya saya mau urus NPWP kok gak bisa.🙄,1,0,1.4.0,2024-09-21 20:36:15,,,1.4.0
6,3b5b5582-0c94-4fc7-a708-c69ba76a65e6,ZZ Z,https://play-lh.googleusercontent.com/a-/ALV-UjVYAEtf4pZpWSVfpR9wUtG9ZwIGJ9fWR3eqWA6Ba57xdAcaAwc,Mau bikin NPWP bagian otp nya gagal terus kesal pdhl udh isi pulsa..,2,0,1.4.0,2024-09-21 13:03:36,,,1.4.0
7,bc8e9b0c-1d2f-4db5-b353-8cfa8d1b4684,Endo,https://play-lh.googleusercontent.com/a-/ALV-UjWY2ug5MeRnLIOTzW6vMmasPa256_r24V3F2eU2Ayh8WBU5b5Mq,Aplikasi sampah,1,0,1.4.0,2024-09-21 12:32:05,,,1.4.0
8,c3a99943-9c86-4f16-9091-2cf50821f1ee,Ready Gaming sven.L,https://play-lh.googleusercontent.com/a-/ALV-UjUQkiGZtNHph7QG7ZUDKNGr_HTFNrUBGIw2YWvm4wYukZx5YLc,Ternyata bgni pajak saya dipakai untuk aplikasi yang tidak berfungsi,1,0,,2024-09-21 05:25:23,,,
9,b6c52d12-3974-4318-9de4-9993cb8e91c4,Mei Diantoro,https://play-lh.googleusercontent.com/a/ACg8ocJgDusn1bsdPaF_DEoy15pLbP3fGIZgXc1lzD9bP5177k4BWg=mo,"Bapak atau ibu yang terhormat,mohon aplikasi ini di benahi.masuknya susah,sekalinya ambil verifikasi di gmail dan mau isi ehh kembali ke tahap awal.mohon dipertimbangkan demi nama baik lembaga pajak",1,0,1.4.0,2024-09-20 14:41:01,,,1.4.0
10,cbb90608-3e21-46f7-bfa6-d9ef1c49b6a9,Rasma Wati,https://play-lh.googleusercontent.com/a-/ALV-UjVZ-G-Yb_d04VIY-ChDeQ6e69m5BAlO85MHRYuSjFIayOQYhLg,"Oke belum berkembang, mulai berkembang, sangat oke berkembang 🤭",3,0,1.4.0,2024-09-20 05:59:02,,,1.4.0
11,baa93028-46a5-404b-8c0e-d67ce0ae499f,Theresia Ovin,https://play-lh.googleusercontent.com/a/ACg8ocLwaFiIJvTgJg5fWiiMKi5mxXpmyeT673rFDFS1HiJPPK2QCw=mo,Semoga berfungsi dengan baik,5,0,,2024-09-19 11:14:08,,,
12,e7149129-aa2b-4bf4-b03a-e703c75ea58a,Dedi S,https://play-lh.googleusercontent.com/a-/ALV-UjUMqbl2gfXe9Y4hoMXHjghMIebmvZjFdOtAfDlnqzKZhiiTnzeH,Sampah memang gk bisa registrasi,1,0,1.4.0,2024-09-19 10:27:04,,,1.4.0
13,e7cb7785-eccf-4c0d-a1c8-4e9928b16d54,Rehar 332,https://play-lh.googleusercontent.com/a/ACg8ocLC3AOvha7jt1zRFM1dfYwmBdbB4jC-2syqknI6h-g6NfmNOg=mo,"Sumpah ni apl bener² mempersulit bgt, gak sesuai harapan",1,0,,2024-09-19 09:24:03,,,
14,dfc214ea-23ad-4db9-9582-93ce7f498701,Muhamad Rizal,https://play-lh.googleusercontent.com/a-/ALV-UjXSr-ZAML7OquQrforxz5rz6CrLSVKPuRnvlYB6H9C3EB5X-LQ,Ini duit anggaran pajak yang begitu banyak dari rakyat ga sanggup buat bayar IT yang ahli dalam bikin web dan aplikasi?,1,0,1.4.0,2024-09-19 08:03:59,,,1.4.0
15,6b46bd53-19e9-4829-bc93-5d90d1614e07,Agin MS Official,https://play-lh.googleusercontent.com/a-/ALV-UjVYopcFXztmjabW4rhgNlfu6-IJJCb6bGgcYt6FZ--owGCJVSAj,Aplikasi ga bermanfaat sama sekali ga ada otak,1,0,,2024-09-18 23:44:28,,,
16,9bf2e05e-5459-4adc-bc8e-4638845f9d58,Robert Ludji,https://play-lh.googleusercontent.com/a-/ALV-UjUGg64aL10-WNPhhNd7iCH_d1AC57sGcI1wqnjzoBwZ2mV_G-IciQ,aplikasi sampah!!! di perbarui ribuan kali tetap saja sistem nya error!!!,1,1,1.4.0,2024-09-18 12:17:27,,,1.4.0
17,f06f296e-a18a-44f3-91c8-9806aa7ed6b5,Meyusman M,https://play-lh.googleusercontent.com/a/ACg8ocKHtbTa5jXFb888GxKrfMTAoOZ4LoGh0549C_t1-D-0sTPNfA=mo,Tak bisa dipakek,1,0,,2024-09-18 12:07:38,,,
18,709bbf38-b66d-455b-abef-6267b364e900,trinity one,https://play-lh.googleusercontent.com/a-/ALV-UjVLFdK7dkxt_b-1ftCopWNovaEixmEfHyH9Ck5e-GAKFoAV9qJO,Baik baik saja,5,0,,2024-09-17 20:36:14,,,
19,c5b77ec6-5dc5-45a9-9203-29848674bc9c,Nova Asianna Simanungkalit,https://play-lh.googleusercontent.com/a-/ALV-UjXgYPQuEHGeeTrRC3LK3oBThRUDTZhyEQsMnJWIpsAJ5qvQeZHO,"Sangat terbantu mendapatkan EFIN. Gak perlu menunggu lama, langsung dikirimkan ke email.",5,0,1.4.0,2024-09-17 16:09:05,,,1.4.0
20,e5c100c1-e88a-4f7e-bad7-e91f47a67836,Agus Soleh,https://play-lh.googleusercontent.com/a/ACg8ocJNFSRdmrRMBJ14RsfxBd4egafhcol3jtWhF2PJI-fxmh0osc8=mo,Ok,5,0,1.4.0,2024-09-17 14:14:32,,,1.4.0
21,d8feafae-f2ed-42f4-9944-55a1543142c9,Fahriabdurahman Abdurahman,https://play-lh.googleusercontent.com/a/ACg8ocJkS1oTFYLPwGJwQjSxXMRJ4CRC-Y7vf4gXnYvlcarWQge4ag=mo,Nunggu balesan email aja susah nya minta ampun,1,0,1.4.0,2024-09-17 12:50:13,,,1.4.0
22,1684aab7-23eb-4690-906c-46afd9fbd7f1,Tarmidi Slamet,https://play-lh.googleusercontent.com/a-/ALV-UjWsmW9D6u7z8i7vCHRLXzKJ8MPlXp7sW3Vx4tQ-lD6Jnsu_S-Ly,Ok,5,0,1.4.0,2024-09-17 11:12:37,,,1.4.0
23,6c871a20-e277-498b-9b36-c9382076c212,abdul karim,https://play-lh.googleusercontent.com/a/ACg8ocJ9ThPlu8RrCYxxqPDk5_RfFe5yBoVagsK1TNFtyU8B9Am5WQ=mo,Aplikasi tidak berguna.,1,0,1.4.0,2024-09-16 23:37:15,,,1.4.0
24,ee4cb4ab-db82-4b80-9d4b-f91a008efa97,Arfi Ruwaida,https://play-lh.googleusercontent.com/a-/ALV-UjUow09zlx3aw0A7J7v_ZGp-tH43TBa-pc6NCGEwXjXqxTWxscs,"Bikin e billing, eh nomor ebillingnya nggak berfungsi 🫠",1,0,1.4.0,2024-09-16 06:45:30,,,1.4.0
25,67a74c27-275d-458c-9b2f-7fbef25b7fe2,Ditt Frizz,https://play-lh.googleusercontent.com/a-/ALV-UjUwBXqsURTZN-_B3PxDbkIRZM-JTZMxFS4rXioiIlx9Wzoy1C4,bikin aplikasi gabisa dipake buat apa dah?,1,0,1.4.0,2024-09-15 20:16:55,,,1.4.0
26,ef1b473b-f1fe-48eb-9a1b-0477de85697a,Ayub Ptk,https://play-lh.googleusercontent.com/a-/ALV-UjWNmj88USaEMSnmu0mR6UYg-9yB5SROz4pMpOJEYBPaHDd0pks,"Aplikasinya sangat jelek, menurut saya aplikasi yang paling buruk tidak guna tak jelas lah pokoknya",1,1,1.4.0,2024-09-15 10:12:11,,,1.4.0
27,253bd0d0-62ea-4da2-b827-84d1ddc109d9,Rizky Adityo Sudrajad,https://play-lh.googleusercontent.com/a-/ALV-UjW46PVUPGvy4ZD8RX1SA89f_mYZXcZlVxrlc-ksKuEPGjYrMgLU,Password sudah sesuai malah ga bisa login 🗿,1,0,1.4.0,2024-09-14 21:28:05,,,1.4.0
28,a8a692c8-24e6-428d-b7d5-b54f781d72a2,Satria 911,https://play-lh.googleusercontent.com/a/ACg8ocLV95nRY0ppX71QH7R2IRe0OU5Jo2O_1AgRdOzcsZXwKF0ixA=mo,Nyerah bang susah banget asli daftar npwp gua kira kalo online bisa lebih gampang ehh ternyata lebih ribet,1,0,1.4.0,2024-09-14 13:51:56,,,1.4.0
29,d5b678a3-a7d7-4860-aff8-96e9264d6151,Mister G,https://play-lh.googleusercontent.com/a/ACg8ocIm1QQHMQpicMMcHdSNJdglXvT_6_jhAkQ2-eG_7E5PvzHdLg=mo,"1 untuk login susah, selalu salah",1,0,1.4.0,2024-09-13 07:11:30,,,1.4.0
30,af072c5d-da4d-4e75-a85f-39e7d242617c,taufiq,https://play-lh.googleusercontent.com/a-/ALV-UjULJUwO9Ft4mwOzz5q7ad9XtlhfVmiY2Xf1AIUEjfP8L9iEsbei,Cukup rating yang bicara,1,0,,2024-09-12 22:30:41,,,
31,84ba9366-9973-40f5-b64e-6322fbd3d9e3,PUJI SANTOSO,https://play-lh.googleusercontent.com/a-/ALV-UjWlvdL1BxsyIJtNt9GfqTM692ttmmqPl4u7PSPGpcn1jOU5Smwu,SDN & NASIONALISME KURANG.....MAKAN PAJAK RAKYAT.. #KONYOL kode otp sulit...,1,0,,2024-09-12 09:37:16,,,
32,2cfdebf9-d8d8-4aa4-9131-3d8e455e9fec,Koloseum Empire,https://play-lh.googleusercontent.com/a/ACg8ocI4u7mu2ZJCI2SAKTW6XtMjyNmGi3rgrnja24l4aZ5bw3LJlA=mo,sampah bat aplikasi nya,1,0,1.4.0,2024-09-11 18:21:43,,,1.4.0
33,c19c1cd3-cfc6-4341-878a-76a79d3be91a,YAYAN P,https://play-lh.googleusercontent.com/a-/ALV-UjXUztwvnnQ689fmtCrbeR8zrsMl2UupejBO_YaT4p53Gco39kUxGw,Thanx,5,0,1.4.0,2024-09-11 11:21:21,,,1.4.0
34,82afcf90-76c2-4668-a6b1-a3c13ebfa2fc,Turino Yusak,https://play-lh.googleusercontent.com/a-/ALV-UjVXOLDdnfbz3_4tZ87Dz8-T1PQITEld4yQWM-pJmVYTACOwRnU,"Aplikasi ruwet, betulin aplikasinya woy.. Jangan makan gaji buta.",1,0,1.4.0,2024-09-09 23:05:00,,,1.4.0
35,e2dec003-65f0-4c0e-a217-b1622c0d41df,Irfan Dwi Saputra,https://play-lh.googleusercontent.com/a-/ALV-UjV_NOdRj8RDqGtF2IwvF-8Te7xrtHAR1QgYPafUWb1R2LZnfEB3,Aplikasi nya tidak jelas baru juga buat eh udah ke blokir yang bener aje rugi dong,1,0,1.4.0,2024-09-09 21:50:13,,,1.4.0
36,9518d72c-31e0-493b-9d1c-5fabcf508352,Adhimi Sipit,https://play-lh.googleusercontent.com/a-/ALV-UjXoIcpsOMellxMNx7pwa7bAtu85bLK_gwF-Ih-ztpQvx2mr5bQf,"Jan duit pajak asli ne gae opo seh, kok kerjo ne koyok ngene wong pajek😤",1,0,1.4.0,2024-09-09 14:09:44,,,1.4.0
37,db969bbc-3713-4b75-a3df-e7ce1fcb17f0,Raju Handika,https://play-lh.googleusercontent.com/a/ACg8ocKBWk6dXJyKczMXYF1LI_l0c98gi-Ku462_tscAKNxpjYluEF8=mo,Good job! :),5,0,1.4.0,2024-09-08 18:58:44,,,1.4.0
38,e21a29c6-cf46-4452-90ca-44bd0358f6a9,Angga Nur Salim,https://play-lh.googleusercontent.com/a/ACg8ocLU-HmxKjY4QiKm1xOnkYpGC6INvTue7iiZxmb6-y_Cr9r9Mg=mo,Sampah,1,0,1.4.0,2024-09-08 09:16:17,,,1.4.0
39,1247eb20-7e79-4fe0-9d43-e906a9d0ee57,Agiel Waliulu,https://play-lh.googleusercontent.com/a-/ALV-UjVDDNTqTfOUXpFCpn23fE3W0y2Ty0IJYYcpF-GZ_eE406fJObs,Gak guna👿👿,1,0,,2024-09-07 22:57:23,,,
40,48d9d87e-662f-4b67-9387-4adf6b7f6724,Indra Setiawan,https://play-lh.googleusercontent.com/a/ACg8ocKVVEUD7qBkzY7p-p42CGfA78c6COWML24jlulvfrHWmdX8ng=mo,"Bikin aplikasi ga pernah niat banget ini pemerintah, uangnya di kemanain dah itu. Aplikasi sekelah pemerintah kalah sma aplikasi buatan anak kejuruan 😌 ini pke aplikasi, tetep aja di lemparnya ke website pake peramban yg ada di hp ny",1,0,,2024-09-07 10:56:22,,,
41,14958554-6cfc-47a3-8860-8dc0e4987327,Bayu Exca,https://play-lh.googleusercontent.com/a/ACg8ocLQgEA__0pY4xbg82g8FIGDxrEZUWZkiRFPQHRkBF6bJZ-hXg=mo,"Gak jelas, , log in di web bisa.. Loh in di aplikasi error terus...",1,0,1.4.0,2024-09-07 08:09:48,,,1.4.0
42,c96ba985-1c8d-4fb0-8660-2cea49c179c2,Hardiman Iman,https://play-lh.googleusercontent.com/a-/ALV-UjWWzI_759-goZYW1vbaQvKFrEIzY829Ljtu20om2ORj-_VOiYtrsg,Bagus,4,0,1.2.3,2024-09-05 16:57:36,,,1.2.3
43,ef5269c0-e654-4622-b137-c91b76e112b7,bonte gaming,https://play-lh.googleusercontent.com/a/ACg8ocL5w1W7eTVZStlaDuMUoo4hRc5mOyKoGzUWoGpClOiZZJEjaw=mo,"Aplikasi kemplo, buang-buang duit negara",1,0,1.4.0,2024-09-05 16:23:33,,,1.4.0
44,3fd2a352-7409-4aa5-9cca-a1f5df57bfc9,様Armandana,https://play-lh.googleusercontent.com/a-/ALV-UjWQKRl9ZWmnUXdhx4kWG6lB7hq8oZEjGhki1cW2Ju__vVDFqhJS,"Aplikasi anak bangsa emang ampas, jelek, kualitas buruk,, server sering eror padahal jaringan lancar paket banyak,, perbaiki lagi dek aplikasinya, sekelas aplikasi pejabat kualitas buruk, uang kencang minta urus lama",1,0,1.4.0,2024-09-05 14:20:32,,,1.4.0
45,7a619dc0-9cf2-4b93-9854-943bb7b18407,Yogi Seftiya,https://play-lh.googleusercontent.com/a-/ALV-UjVicYQdXBKJ1xoIQ_rxge6gYOSZaBpLnO0Y2W7Wy3LW15bmr5o-,Sangay bermangfaat sekali sangat membantu,5,0,1.4.0,2024-09-05 09:41:31,,,1.4.0
46,4d697e83-acbb-49e9-bb41-ce1449f72d7e,Mohamad Yarid,https://play-lh.googleusercontent.com/a-/ALV-UjWgUFk8W4aGpW1RVbcdRcJlBywY3dHkiAySZpM7_SSEqWLPDv8,Sangat membantu dalam pembayaran pajak tanpa perlu ke kantornya lagi,5,0,1.4.0,2024-09-04 18:36:31,,,1.4.0
47,58eb10b3-ddba-495e-990c-3fb916315ba3,Rahmatul Karimah,https://play-lh.googleusercontent.com/a/ACg8ocIquucPbmqSIP0VLmkn0cLMA-kmKDKomh5g-UkVBzD-lSKloA=mo,"Baru download udah gak bisa kebuka,njir belum apa apa loh,mempersulit rakyat banget sih",1,1,1.4.0,2024-09-04 12:17:09,,,1.4.0
48,f2b5389b-62bb-49a4-ba55-eed6e7a42813,Kadek Menara,https://play-lh.googleusercontent.com/a/ACg8ocIa06lglo6obb6gClag5UaK6YVlUl-O5d82asyRehTNgG-Hdg=mo,Aplikasi paling buruk yg pernah ada,1,0,,2024-09-04 07:18:18,,,
49,048ffd53-ce3e-4ac9-8781-3d00c4f0ab18,Sukiman Hasmah,https://play-lh.googleusercontent.com/a-/ALV-UjU4PFbPCvMSetwtbtFb2khIRT4Hnm-RUXz7T4b-Cat5tCtLmDpH,Ok,5,0,1.4.0,2024-09-03 20:10:37,,,1.4.0
50,5bbb6a47-3f00-4139-8a67-5184e38671df,Namikaze,https://play-lh.googleusercontent.com/a-/ALV-UjX0xurh79TPNl69RZzr_rpbO3iMxJjpI5NUR-VZR9rFmTKM4lrR,Lupa EFIN masih sulit dan ribet. Harusnya ada opsi untuk kirim kode EFIN via SMS/WA. Jangan hanya via e-mail saja.,1,0,1.4.0,2024-09-03 17:27:28,,,1.4.0
51,f528524b-5f2a-43b2-9c94-e5da195a51fa,Ahmad Stefani,https://play-lh.googleusercontent.com/a-/ALV-UjWsx27EM0LEinPns3oicumQ_KO0kT0FNm0zOW_Bv8zlAanwzw9R,Ga Guna!!!,1,0,1.4.0,2024-09-03 09:03:46,,,1.4.0
52,932c59a0-afc2-4535-88f0-0f818e277a85,ajier rafly,https://play-lh.googleusercontent.com/a-/ALV-UjVu4oK9hrOJTEdQvu8HlgnT4WrFVXJ1134hMMojRS6eE3rHB0U,"Tolong admin, kenapa ya ini gak bisa bikin Form Pajak pph21.. Tombol buat nya gk timbul2",2,0,1.4.0,2024-09-03 05:11:41,,,1.4.0
53,98805d55-013e-43aa-9618-82fafee4af50,Agung 62,https://play-lh.googleusercontent.com/a/ACg8ocIKAy2i8EisIO9j-ANqgOdHg5dEs5YNuYet5H72ZGA39FcAuw=mo,"Susah login ,Ribet. Sudah daftar akun di aktivasi malah GK bisa login",1,0,1.4.0,2024-09-03 01:12:16,,,1.4.0
54,746420e8-c076-45b8-9a72-9ca897a904c8,Ted S.,https://play-lh.googleusercontent.com/a-/ALV-UjVk92Tk8PGFV1Jlb9Sy3phC9INttz6xgp_zYizHht9hopOkzCE,situs tidak dapat dijangkau 🤣🤣🤣,1,0,1.4.0,2024-09-02 20:12:30,,,1.4.0
55,3222bf71-cd37-4a69-8901-bf0d3ac43275,Ismanto Gabril,https://play-lh.googleusercontent.com/a/ACg8ocIAIPhPT3dfANwReGAzvE8rVDpsLbdCNNnHEZlIHcRin7rXsQ=mo,Knpa daftar NPWP online susah,1,0,,2024-09-02 17:58:56,,,
56,2091b659-7dda-470f-b48b-422543e0838f,Tufa,https://play-lh.googleusercontent.com/a-/ALV-UjVKDTM4BkeVGzjGd_9B3A8gs_83b5gVan1ob1jmgdHzIEXg1xTN,"Apknya error terus....susahnya cm mau minta efin aja... knp jd smua serba susah ya sekarang klo ngurus apa""",1,0,1.4.0,2024-09-02 17:22:14,,,1.4.0
57,fcc17f13-3e3b-4a62-ad9a-4eb4e933b611,ZURIYANI09,https://play-lh.googleusercontent.com/a-/ALV-UjW_8Y3HDe2t2ATEkbKdcwmPpkVgmWnuyU0Z4Cv0SJR3dVKLP3JG,"aplikasi nya mohon di perbaiki. suka force close sendiri. harap di perbaiki sesuai dengan nama aplikasi yaitu PAJAK. Anda di bayar dari rakyat. jadi tolong bikin web yg seharus nya seperti apa. jangan seperti aplikasi"" murah. Seharus nya anda membaca ulasan dari penilaian ya. !!!! Woi t*l*l respon",1,0,1.4.0,2024-09-02 13:22:47,,,1.4.0
58,ee2bb247-525f-462a-b997-9e0354bc5a3d,Affan Afnx,https://play-lh.googleusercontent.com/a/ACg8ocICHjmBjXgNYseoZZTik9L86F2J5zyt7ywb1EsOxnx3fgAb4w=mo,Website pendaftaran sangat buruk,1,0,1.4.0,2024-09-02 12:48:44,,,1.4.0
59,49081e22-dbb9-40d4-9f04-fb07d1872135,Ahmad Rofiq,https://play-lh.googleusercontent.com/a-/ALV-UjXVMG_5j4FHiL9qx4y7pgXlkXY3UL78d1_OpriWc4rmZorFAW1q,Aplikasi gblok cap t*i,1,0,,2024-09-02 01:01:35,,,
60,67a811b1-5518-41f5-85fd-240a88f4f92e,Ahmad Farizi,https://play-lh.googleusercontent.com/a-/ALV-UjWzlCaOGmzeFEpQMdbM7nJLvVg7Zlie7jM8txSv57WvXCoK7326,Ribet banget,1,0,1.4.0,2024-09-01 23:04:17,,,1.4.0
61,c28d2f0e-774a-46ac-9a23-02d3f9055e77,Dimas Ristiyanto,https://play-lh.googleusercontent.com/a/ACg8ocLbZMs0bnIHGgJrJrrtqLavKnBaiREMCMC--bflLbi1vfKXOQ=mo,"Lawak asli ini aplikasi, buang2 duit doang",1,0,1.4.0,2024-09-01 21:36:57,,,1.4.0
62,12a9496d-3468-46cb-9630-7145f2e72190,Iyus Setiono,https://play-lh.googleusercontent.com/a/ACg8ocKgEGI2pJA8SM-s6C9tz1J8hjvj2UYgp9MIIlR_5UhOkf13hQ=mo,bagus,5,0,1.4.0,2024-09-01 14:08:40,,,1.4.0
63,7c1e1295-d217-43e6-97e9-0d811186e73f,Gypsophilia,https://play-lh.googleusercontent.com/a/ACg8ocJdmFqOpxzcTj-TSjSaLRz-aED_oaZZZwfHl5Lj3Jhb-bIMcw=mo,"TOLONG diupdate fitur dalam aplikasinya, agar ada fitur untuk dapat meminta No EFFIN baru scr online, ngapain bikin aplikasi buat dipakai secara online, kalau pengurusan untuk no Effin 1st time saja harus secara manual? Aplikasi dibuat untuk memudahkan user bukan merepotkan. Aplikasinya tidak berguna sama sekali ini. 1 lagi NPWP saya dibuat scr online, katanya kartu fisiknya akan dikirimkan 2 Minggu kemudian, ke rumah, tapi sampai detik ini, kartunya blm juga sampai ke alamat rmh saya. Miris!!",1,6,1.4.0,2024-08-31 20:59:47,,,1.4.0
64,47765250-e913-423a-903e-534ee556a696,Agus Wahono,https://play-lh.googleusercontent.com/a-/ALV-UjVqo6YS4YX6AquM-Wl0rZubonO0hp3jlbNkzw0VbvdyXaUuYX0,Data gagal tersimpan eror padahal sudah tinggal terakhir aktivasi,1,0,1.4.0,2024-08-31 18:15:59,,,1.4.0
65,256893f8-2ead-49d2-a45b-6cac33466ec4,Den mbawur,https://play-lh.googleusercontent.com/a-/ALV-UjXivCiqfpypNPDScRYEEO5gqOl_ZR2lBYPjfW7kXQfdyusoXdJ-,Aplikasi ga berguna,1,0,1.4.0,2024-08-31 16:11:37,,,1.4.0
66,fc0f1234-e0ce-4328-8ab8-dce0a3a267e7,agita suci,https://play-lh.googleusercontent.com/a/ACg8ocLAIepZMiY7oO_Eox0E5QXDbUBbRno8Bn3OeXViKzN5ncL1Yw=mo,"Kalo gk butuh² amat males dah instal nya juga, baru aja download udah di suruh update lagi, hadeuh belum aja di pake udah menghambat🤦‍♀️",2,0,1.4.0,2024-08-31 09:54:56,,,1.4.0
67,fd81081a-b1db-4abc-bc49-60a2919ca2c0,Hafsah Fadilah,https://play-lh.googleusercontent.com/a/ACg8ocLpeS2odF_GUYxSZDNyUm0oTT1IrHXywG82noiH2QDOX6KRAQ=mo,"Ini bagaimana yaa mau pengajuan ulang EFIN pas dapat otp dari email selalu gagal terus entah darimana nya coba, coba tolong diperbaiki lagi lah , mau datang ke KPP kejauhan masalah nya",1,0,1.4.0,2024-08-31 04:28:26,,,1.4.0
68,0a6a7ebc-fb4b-4ff4-bedf-a8fb19840d8f,Elfrin Ginting,https://play-lh.googleusercontent.com/a/ACg8ocKRBpDyj_oGQlu5zWE6Bxpklk8KxLrXrbCYwQQv6sGAue-ZIw=mo,Sangat Membantu,5,0,,2024-08-30 21:05:20,,,
69,4cc7ab65-6b09-4148-b4ff-2bb9c4d3924d,rintea korg,https://play-lh.googleusercontent.com/a-/ALV-UjVNShwKhKqNDipJKydhJSGiwCBKftxO6TYgFTbYNlnviIeWTd8h,Aplikasi GK gunaa,1,0,1.4.0,2024-08-30 19:19:16,,,1.4.0
70,3ff3ba85-8570-439b-b25b-1f9f4d5c841e,Adilla Triana Oktavianita,https://play-lh.googleusercontent.com/a/ACg8ocJBjzYNcO1znSXuiGoC8T99DT2QmnxEEmn8S6tc2WkNS1DzehE=mo,ERORRR TERUUUSSSSS,1,0,1.4.0,2024-08-29 08:24:35,,,1.4.0
71,de6c1a5b-daa2-4258-b355-dc4d095f3dc1,Amycu Bukan (Amycutoo),https://play-lh.googleusercontent.com/a-/ALV-UjXO6KuJrRyIJousjNNbcVKo37e0QN1VzdFDIy4xKuI2SawWyWCB,"Sepertinya pliksi mupun web berguna atau berfungsi klo di dalam gedung pajaknya deh, solnya email sma pass yang aku masukkan ydah bener bgt gak salah tpi tertera salah. Wkwkwk",3,0,1.4.0,2024-08-28 15:57:14,,,1.4.0
72,c2d103d3-68f4-411f-b57c-28be55158a4a,Muchsin Al idrus,https://play-lh.googleusercontent.com/a-/ALV-UjWgse1bf266ZlyzTHa_3bEUI4XSCPYBPmGyVin0tK6Wfd0kd4E3,Bagus,5,0,1.4.0,2024-08-27 19:37:28,,,1.4.0
73,16256f64-1ef2-4a1a-ada9-69a10e07bdf2,budi anto,https://play-lh.googleusercontent.com/a-/ALV-UjVKkeGeKgs5VIKXmSoY9OoOjethK2IPkj8wb0tHKOXiFA1gsFC1lQ,"Sudah lama tidak buka djp, begitu dibuka kagak bisa lagi, admin mohon di perbaikin demi kelancaran.",1,0,1.4.0,2024-08-27 14:40:51,,,1.4.0
74,7bc13c4d-1e42-466f-93db-d13b95afc720,ZABID R,https://play-lh.googleusercontent.com/a-/ALV-UjWDZduzd_X2hJdo-fdPGtDXQgqjyhKKSMKMMAevOZJ1W169cuvjyQ,oke,3,0,1.4.0,2024-08-26 19:43:48,,,1.4.0
75,5564e3a4-58f3-4d63-9301-b495a3d6404f,Ridho Febriano,https://play-lh.googleusercontent.com/a-/ALV-UjXd66NTSj4b23JDyZsYtPTV9UgIbX5nKnm1OIbTrQdwQshpHnk,Aplikasi banyak bug. Gak jelas. Pencet dikit malah keluar sendiri,1,0,,2024-08-26 17:09:02,,,
76,60b6125d-83ff-4373-bbcb-b7f0a23257e0,Zero Gaming,https://play-lh.googleusercontent.com/a-/ALV-UjW1_Enw4ubTCGh_LH46w5FM-MX9hIpRFi74QGI71UF9G2n9rnID,PERBAIKI SYSTEMNYA!!!! JANGAN CUMA MALAK DOANG SU!!,1,0,1.4.0,2024-08-26 14:27:52,,,1.4.0
77,30038454-5fbd-4e1a-9b9f-8c631ecaf2f0,Saepudin 10,https://play-lh.googleusercontent.com/a-/ALV-UjVisNO6fmC09i1Jqq5HmiVqG0i65d0NNssbuN5UibclThCVoHY-,Aplkasi gk jelas,1,0,1.4.0,2024-08-25 10:53:29,,,1.4.0
78,d8fd884a-f1d0-40f2-9824-04f6177ccd31,Jali Jr,https://play-lh.googleusercontent.com/a/ACg8ocLGb97ImoICjA4ls8ktl0AA-S6-LjZDqvE0DN-jdKQPESU0hA=mo,"Aplikasi sampah buang"" duit rakyat aja Halah",1,0,,2024-08-23 22:07:08,,,
79,bf20a80c-b3ba-40c6-a537-ada8ca64ceda,Abu Nawas,https://play-lh.googleusercontent.com/a-/ALV-UjUGot5jwg1rUDjONumkcyyFvhumGJmDu8bvZN9FRDMF21Cq9aI,Sampah gk ada fungsi sama sekali....,1,0,1.4.0,2024-08-23 08:06:32,,,1.4.0
80,79d4810b-22b0-450e-8f0b-7a39ff61c093,Sisi Lia,https://play-lh.googleusercontent.com/a/ACg8ocJs4uJ11Tu3gqnDLrUPFtKXse4NObPrj87FDqmw41RwghQR4Q=mo,Asli busuk banget smpe pulsa hbis gk bisa verti otp,1,0,1.4.0,2024-08-22 14:04:46,,,1.4.0
81,e06deea9-4cc7-45a1-8673-867089d5dbb2,Haryadi (Hary),https://play-lh.googleusercontent.com/a-/ALV-UjUx9g0IZVVrkMvTFF6d_ulL30jhQpFTjRMaTH2jTevIifNwB0SX,Useless,1,0,1.4.0,2024-08-22 09:16:45,,,1.4.0
82,60add5ab-faf9-426d-9af7-b4775b0b457e,andonk setiyawan,https://play-lh.googleusercontent.com/a-/ALV-UjXtzm7EQ7dXfUw4oPxyW_DLiWKDWtDBeS9EIxwuBZjfFgJvLic,APLIKASI BUSUK !!!!!!!!!!!,1,0,1.4.0,2024-08-21 19:14:55,,,1.4.0
83,f2e3445d-0bf6-4d2d-a919-78b348eecba3,Aep Daily,https://play-lh.googleusercontent.com/a-/ALV-UjXItEE2ZAUr6UNfDnQrHdOy2dJH0VQc5W9patxVSKRQfpyt94cm,"Syarat lengkap cepat,,",4,0,,2024-08-21 09:09:58,,,
84,53fd9343-7483-4fec-9b1f-3c8190d1bc6e,Fais Sal,https://play-lh.googleusercontent.com/a/ACg8ocLsgVOXnse9ovPftkaAioBkaDBxo_sseCgOuwwpRckLAZHGxQ=mo,Bad,1,0,,2024-08-20 22:22:48,,,
85,55a7e01d-1bad-41a3-b372-3c38d4b61358,Sofi Maulidi,https://play-lh.googleusercontent.com/a-/ALV-UjV6sBVq1drB27O36r-lpEcpgp0tQoLGV563j3DtbBH6KD8JsD4,"plis laah pelayanan di tingkatin lagi, mau login akun pun susah banget udah nunggu lama eh katanya admin masi sibuk hmmmm🗿🗿",1,0,,2024-08-20 12:47:26,,,
86,588e8510-a03b-460c-b63b-5a6c4b278bd6,tanjungd pamungkas,https://play-lh.googleusercontent.com/a/ACg8ocIWvT-dojpg8dPgbdLjKO9Bug_f_NGLb11aJL1h6nlqgf0WMg=mo,"aplikasi sampah, negara bayar lu pake uang kami bikin aplikasi begini aja ga becus",1,0,1.4.0,2024-08-19 16:26:28,,,1.4.0
87,fd6cad9c-d1fe-4fbd-8af6-e1ca596f965a,Daniel Rinaldi,https://play-lh.googleusercontent.com/a-/ALV-UjU39LuEf13Gp2_J0UG7vYggsdGowtHiYoaajmRbSCHeaSKleVta,Jos,5,0,1.4.0,2024-08-19 09:38:13,,,1.4.0
88,b603ee36-de3d-43df-8501-9803aab95c9f,Binsar Wibowo,https://play-lh.googleusercontent.com/a/ACg8ocKifMGA-X62FoVTnLzRKVA0JqabnwxRczudoHb5LNjUcl7d=mo,Ok,5,0,1.4.0,2024-08-19 09:32:53,,,1.4.0
89,4862662c-7206-469b-a811-1b4632ec17bc,Laili Choirotus Sholikhah.,https://play-lh.googleusercontent.com/a-/ALV-UjUo5k-BNgQEamdrjoMBJKyGC30QIy5RUK_UTujW7drD3i_1wLo,Bulan Juni kalau nggak Juli kemarin aku unduh apk ini karna lupa efin. Mudah tapi untuk nunggu email buat Nerima kode nya laaaamaaaaaaa bangtt gak ada masuk malah.. berkali² dicoba dihari² brikutnya masih sama.. pilih dikirim pakai nomor juga gak bisa.. trus pasrah.. hapus apk.. trus sekarang iseng² lagi eh bisaa.. cepet lagi nggak kaya yang bulan² kemarin.. lancar sampai bisa lihat kartu NPWP online ku.. terimakasih sudah di update untuk pelayanannya.. SAYAA SANGAATTT TERBANTUUU TERIMAKASIH 🙏,5,14,,2024-08-19 06:45:14,,,
90,224c8b8b-af1a-4e39-a14e-c72cb76c4f14,Yuliana Yuli,https://play-lh.googleusercontent.com/a/ACg8ocLGfqkCbmlVzh5WwCbgcBLxruDykVHJ7-U4OyMof7DfsXHxKA=mo,Mau minta efin kagak bisa2 selalu keluar sendiri dari aplikasi!!!!! 👎,1,0,1.4.0,2024-08-18 21:33:19,,,1.4.0
91,e8380070-25f4-427e-ba16-1a6f4367a154,Eki Page93,https://play-lh.googleusercontent.com/a/ACg8ocIGiXlO1WHbne-6oiHtO27KzJhOJ7J3dpr1eDmeOGQzCBujsQ=mo,Aplikasi sampaaaaaaah,1,0,1.4.0,2024-08-16 15:48:29,,,1.4.0
92,3b3c576c-7e18-4605-a272-004334b54693,Harlan Maulana,https://play-lh.googleusercontent.com/a-/ALV-UjUFJ6toRp9pQcNbC9FnXKXg4jufKp4K51N2BsFiCl6ioCQbXCs,Apus aja sampah,1,0,1.4.0,2024-08-16 11:32:09,,,1.4.0
93,2ea5de0a-7410-479c-947e-d67d9e81a319,Daniel Kristiawan,https://play-lh.googleusercontent.com/a-/ALV-UjWbdEyI339YQ8ZG1Z32vSEYkvNw_s_51TaITPpaa7wmdtW0f8wy,Susah mendaftar,1,0,1.4.0,2024-08-16 11:12:17,,,1.4.0
94,69307eb8-22ac-4baf-bc63-1cff958aa0dc,Mathius Fredrika,https://play-lh.googleusercontent.com/a-/ALV-UjUPzgOR_YTE7REFNCJi65dKpvqT7M2OhzBUKhK543ZaLEvNA7w,"enggak bisa login, mau di isi informasi akun yg benar juga tetap enggak bisa login, coba pakai cara password juga situsnya enggak bisa di akses, aplikasi apaan ini",1,0,1.4.0,2024-08-16 10:49:02,,,1.4.0
95,279559e4-8b23-483f-8694-035d99e8b1fc,adhi prayitno,https://play-lh.googleusercontent.com/a-/ALV-UjVfyykybugeAzxdPfH5F70W6j6d7J5oUe2XGOQIoNexKLmL75If,baru beberapa menit instal apk ini....mau masuk ada laporan suruh update... yang harus di update apanya...????,1,0,1.4.0,2024-08-16 10:12:30,,,1.4.0
96,09f98421-29aa-4cdc-ac41-9ab37d24bf7e,24_muhammad Zakka nur sakhi_X TKRO 1,https://play-lh.googleusercontent.com/a-/ALV-UjUlxb4bEUoZcGonX04QLor_AcDfIy98J0pfDWtAc18B_zl2TDyd,otp nya susah masuk sekali masuk gagal bang ini solusinya gimana,2,0,,2024-08-15 20:48:57,,,
97,682c20d0-87d3-4c17-a1df-95939a480c8a,Putrii Feraa,https://play-lh.googleusercontent.com/a-/ALV-UjUgJGiXoJP6OiTeWkswws8HmsgcZkLeTDy0Zi11Q1YknKpXSuHo,"Ga guna banget, gabisa buka web apapun lambat bgt aplikasinya!",1,0,1.4.0,2024-08-15 18:43:35,,,1.4.0
98,677f7110-c391-47db-8398-26ca698f021f,Nurul Mellysa,https://play-lh.googleusercontent.com/a-/ALV-UjX-0Q1OPAO7akqVOSFU_p2wyrtCuvapUySD6Et1lWJmABMxwHng,"Sengaja aplikasi di erorkan dan tidak diperbaiki,,,agar masyarakat bayar buat pembuatannya 💩💩💩💩💩💩💩💩💩💩💩💩💩💩💩💩💩💩💩💩💩💩💩💩💩💩💩💩💩💩💩💩💩💩💩💩💩💩💩💩💩💩💩💩💩💩💩💩💩💩💩💩💩💩💩💩💩💩",1,0,1.4.0,2024-08-15 09:27:08,,,1.4.0
