,reviewId,userName,userImage,content,score,thumbsUpCount,reviewCreatedVersion,at,replyContent,repliedAt,appVersion
471,9f80fab0-8d4e-4d79-9bf5-6f4b41f2d90f,Frenc Franc. SP,https://play-lh.googleusercontent.com/a-/ALV-UjWvQKIopHJevcyps9hHfY2mRpTAO2EGCGfx1-Bb_ehj6yZf5p4,Mantap,4,0,1.4.0,2024-05-22 22:13:29,,,1.4.0
472,204bf0dc-fd72-432f-86f5-f35e9c725234,Hehe Boyy,https://play-lh.googleusercontent.com/a-/ALV-UjVtJKrp38AM1kHfBprF8Z0Rbc0jDD3j_fLBdzbpHVxiaArietgX,"Codingan eror parah , udah sesuai nik masih aja di bilang salah ,",1,0,1.4.0,2024-05-22 18:46:44,,,1.4.0
473,48788e28-4cc9-46bd-b85a-965fdd9775bf,Kreator Ndablex,https://play-lh.googleusercontent.com/a-/ALV-UjVpqdyYffpBQfsycl1t6Pd68q3ymJc7ArJL7aXird4aNW12afA,"Tolong Aplikasi diperbaiki lagi, ini sudah tahun 2024 semua serba modern harusnya diupgrade lebih baik agar tidak macet dan lag, Aplikasi fungsi seharusnya untuk mempermudah bukan untuk mempersulit",1,0,,2024-05-22 18:34:45,,,
474,13342174-4bf7-495f-880b-81ac4c90ebba,Dwi Fuzi Rahayu,https://play-lh.googleusercontent.com/a-/ALV-UjXXBqHMQjM4i5spVYY-DV7KuvvQ3-0VsWCFJaw6UVhdMj-iZE7s,Saya mencoba mendaftar NPWP tapi request otp tidak ada dikirim,2,0,1.4.0,2024-05-22 11:15:51,,,1.4.0
475,fb621363-d95b-49ae-9d82-b93bba3ee879,Ahmadi Wijaya,https://play-lh.googleusercontent.com/a/ACg8ocLHeUREnO0o4Fwdn3KoJ5hSKgFowBWx3SP4Xq_EdzVZcqv3gQ=mo,Semoga selalu membantu kami,5,0,1.4.0,2024-05-21 21:44:14,,,1.4.0
476,1eb1bcba-8b4a-4be2-8c49-d7f29d06fef1,Go pro,https://play-lh.googleusercontent.com/a-/ALV-UjW1g3fs0oOTWcwRnhrsWUa0YVn9SCZwo3F5MhFz5F5iqzILs1Q,Aplikasi payah otp aja ngga di kirim kirim,1,0,1.4.0,2024-05-21 19:03:51,,,1.4.0
477,a0c6e199-0477-43dc-bd14-eee0a560cf55,M Saryono,https://play-lh.googleusercontent.com/a/ACg8ocLM7p-leVbuT2BD9IGawxi89H6oNqt03uuYNIJQaC4N0u3mKA=mo,Ok,5,0,1.4.0,2024-05-21 16:05:53,,,1.4.0
478,2cbcbfb2-1a02-4947-baa1-3502914b2a1d,Abdul Rohim,https://play-lh.googleusercontent.com/a-/ALV-UjUzPRXwdAO5H7ntKnSjs1ThdYHQ03RK-njOoU72xH-PdZjDDfx7,Masa ga bisa daftar kocak,1,0,1.4.0,2024-05-21 15:33:37,,,1.4.0
479,4b9c56be-4f60-42cb-bc0c-cf9200737ac5,edward 19,https://play-lh.googleusercontent.com/a-/ALV-UjX2VT53uJPLgH8iyR5jTxDE8DvzrRsOT9lH6wGOnY7V7GlgbTAL,"Saya lupa password, klik lupa password ga bisa bisa, kaya ga aktif gitu...sampe di hapus instal ulang, tetep ga bisa",1,0,,2024-05-21 12:56:14,,,
480,7defa5e0-6c18-47c4-a0ed-a14f50584334,zackharia achyarr16,https://play-lh.googleusercontent.com/a-/ALV-UjV6qSmQKsezyrSoobrL3fvOwguWIMgJEWSPJLXvkzzabvXjYoqF,"Gue ulang berkali kali tutorial masih aja eror gak guna emang ini apk dan situsnya pada eror gak niat bantu masyarakat, miris sekali dinegeri wakanda ini ,situs pemerintah pada down tapi situs slot aman2 aja tuh lancar jaya😂",5,1,1.4.0,2024-05-21 11:04:32,,,1.4.0
481,b6b49be2-b717-44ad-a2c8-a81fae0d3acc,Gelombang Positif,https://play-lh.googleusercontent.com/a/ACg8ocKtB8Wbb0ldXtHVgB7ykP8_Cjl24xDJFKfTEPU6H-xI33zR6Q=mo,"Orang mau nyari NPWP dan cuma tanya nomer EFIN aja susahnya minta ampun, cuma mau bayar pajak aja di persulit. Ndeso bgt sistemnya sumpah!!! Serba online tp di suruh datang ke KKP, Saya yakin birokrasi di KKP pasti lama bgt. Gitu gaji org pajak tinggi tinggi banget, kek alun koruptor eselon III dirjen pajak bisa beli ini beli itu. Sistem tuh perbaiki, gak cuma gaji aja yang gede",1,1,1.4.0,2024-05-21 08:59:12,,,1.4.0
482,2eaca566-9cbb-4741-bf5d-51fbeae94217,tnof art,https://play-lh.googleusercontent.com/a-/ALV-UjX3YSmgl2qkMPtbjzlmdWxivDaVCTOLdqijSRapwmUe2vii9vj2,gagal login terus,2,0,1.4.0,2024-05-20 23:44:31,,,1.4.0
483,bcff76d1-cf77-4f2f-8938-82d90d58cbc9,Yanuri,https://play-lh.googleusercontent.com/a-/ALV-UjUXthRoDdisE24YHDvzpS-offG2LBWuH1fxMqN4wSRy12jk-h9V,"Saya ini cuma buruh, yang secara tidak langsung di paksa bikin NPWP. Jika prosesnya mudah sih mungkin g masalah.",1,0,1.4.0,2024-05-20 20:40:40,,,1.4.0
484,15ad34bc-3d22-4e71-8446-ebc78eb9fbe9,Teh Pucuk Harum,https://play-lh.googleusercontent.com/a/ACg8ocKUeFu7igUx8rikJRAM6swPXC2AY-LHv_R-8EUvzaqK5ScofQ=mo,Aplikasi informatif dan mudah dipahami,5,0,,2024-05-20 18:49:33,,,
485,4c581f60-1fe5-4a0e-885c-b439336334dc,channel 611,https://play-lh.googleusercontent.com/a-/ALV-UjWPFE8zrtOwyibErYUrPK2ffu8WBY-Mq25taNN_UAGnx31IYrQy,"Kenapa mau bayar pajak aja di bikin ribet. Kemaren saya beli motor bekas, di STNK nya ada fotocopy pemilik nya. Tpi sang pemilik udah meninggal,jadi di jual dengan istrinya. Lalu saya ke kantor pajak untuk bayar pajak kendaraan, lah dia minta orang nya datang. Udah saya bilang orng nya udah meninggal. Ini ada Poto copy KTP nya. Trus orang pajak nya tak mau proses. Heran betul sama orang pajak, kita ada niat mau bayar malah tak bisa. Ya udah saya biarin aja tak bayar pajak sampai sekarang.",1,4,1.4.0,2024-05-20 18:31:15,,,1.4.0
486,462094e4-3a04-4ba0-9fa0-078a9257316f,Dedi Prayitno,https://play-lh.googleusercontent.com/a/ACg8ocIqfan--5IlYawFsXHHWJdGCcohnQTpqbVlGwVN6BWgDh45=mo,"Apk gk jelas susah masuk, begitu masuk isi data tiba tiba eror,di ulang begitu terus begitu masuk gagal terus",1,0,1.4.0,2024-05-20 17:40:59,,,1.4.0
487,aba35e79-4704-4dbe-a1e6-257b3fc1fee5,Ridho Kurniawan,https://play-lh.googleusercontent.com/a-/ALV-UjVHLQ4oRFzOflsHvj3mQOplVyE5csrZKyWq5pcc6T_wRCzrYbk,Angel angel,1,0,1.4.0,2024-05-20 11:44:55,,,1.4.0
488,ea43c91e-c707-43b4-abf4-70bfc48f80ee,Ana Kiyudth,https://play-lh.googleusercontent.com/a-/ALV-UjV_0QZ-4uLTJwtjP9LzqB3bMlEi3HblJKgLrhBo3r2MI8rBnjst,"Tidak bisa login, padahal semua datanya benar.",1,0,,2024-05-20 08:01:17,,,
489,875a68f5-12e6-461e-bded-c00c8a09fd8e,Rusdi 216,https://play-lh.googleusercontent.com/a/ACg8ocKS1uDx4roUq37Wd2LsCeUKbr4nK7x7-JSxgLNcxhKkNzuRdpCB=mo,Pembuat aplikasi nya kurang bagus,1,0,,2024-05-19 22:59:27,,,
490,7f0a0aa6-6ed4-4a28-896a-913288621e37,M. Siswaliadi,https://play-lh.googleusercontent.com/a-/ALV-UjXhGCmgD6VoXdfhTbBqqC8gYRfwgyNomzt8LwjNTJtLP7gdPZ4Y,Busuk,1,0,1.4.0,2024-05-19 21:52:41,,,1.4.0
491,415aee36-1398-4797-b5f5-f9123d6efe13,Ahmad Fajar.M,https://play-lh.googleusercontent.com/a/ACg8ocI6G42Hbncbke6anX4iO6OqvgHdhfkB3gyjVx8KRP0c7MGyng=mo,"kenapa ya,saat masuk akun di web ereg.pajak.go.id npwp/nik dan pasword bener dan bisa login, sedangkan di apk M-Pajak npwp/pasword salah??",1,2,1.4.0,2024-05-19 13:45:37,,,1.4.0
492,55a90ec2-1116-4692-ab2b-b61901ffb240,jombang jatim,https://play-lh.googleusercontent.com/a/ACg8ocLk22Qk1NNaQaxz_qgyvrrshZ_-hgNS21mxKHIHjlFhcWJYdg=mo,"Mohon untuk di perbaiki aplikasinya, masak mau minta EFIN selalu gagal padahal data sudah benar",2,1,,2024-05-18 20:20:07,,,
493,15352cf7-019a-4638-af17-d2ddc0d9123e,Hbs 969,https://play-lh.googleusercontent.com/a-/ALV-UjVLplT86pAMxSc0rU59_zj1lntjpIsu8Dc6wRVesOU9UlWG1Rs,"Aplkasi b2 minta otp gak muncul, bantuan nye sengaja di erorin",1,0,1.4.0,2024-05-18 20:09:21,,,1.4.0
494,4380d2e8-79e6-4ab0-a532-5de86395e0c5,indah diana,https://play-lh.googleusercontent.com/a-/ALV-UjWea8TWh8VT9xPyiuHmcz2zHGQooX0Eba7bgBHNFPkOZ3dKzEUg,Lah baru aja selesai bikin. Masa mau login susah amat data tidak ditemukan. Aplikasi dajjal. Ngabisin duit rakyat loh,1,0,1.4.0,2024-05-18 16:01:45,,,1.4.0
495,71d70099-c365-4923-a49d-58e31c3c7b65,Ilyas Ardi Saputra,https://play-lh.googleusercontent.com/a-/ALV-UjWuGUfuKz3ZxG59tdusZcE6iUXkGA67Jr0whF0doNNG3p1QlAZl,"Aplikasi ngontol,,,situs nya eror lemot mending situs bokep tolol",1,0,1.4.0,2024-05-18 15:35:47,,,1.4.0
496,e2e18cdc-38ba-44c9-a8be-cef5e0ecec34,Ristiananda Santuy,https://play-lh.googleusercontent.com/a/ACg8ocIuU24QtB3MV63U-maus7QuRhNLltm0djbgjaY9DoKkdIj1mQ=mo,mantap,5,0,1.4.0,2024-05-18 14:37:14,,,1.4.0
497,2259ebe3-a243-4338-8b14-eac213586415,Mas A'ad Seller,https://play-lh.googleusercontent.com/a-/ALV-UjVmfyx7XPkm_tpyWZ1wAq62PVxbirs2A7keefVpAyzmBdqqizrd,Nggk guna,1,0,1.4.0,2024-05-18 11:46:58,,,1.4.0
498,47b08b9a-a852-417a-8b96-45fada9df134,IndiHome Internet WiFi All Area Indonesia,https://play-lh.googleusercontent.com/a-/ALV-UjVV95ZJ0M_pjB6zYkmSQ5Qgbub3hacjEt2lx03bWj8IVxYr2FyXiQ,aplikasi tidak jelas. sudah isi pulsa untuk daftar verifikasi pendaftaran tapi tidak ada kelanjutannya. gimana ini min?,1,0,1.4.0,2024-05-17 17:18:33,,,1.4.0
499,27a79d86-6b0d-4ec3-a508-f2cb556092dc,Ripaza,https://play-lh.googleusercontent.com/a-/ALV-UjXKG4SDmpmvsQ2lBFF6F-d8A3vNHfCF3BpZeKv_6JKX5ODXl9IE,Ini aplikasi yg gue instal versi terbaru kan? Tapi kenapa pas dibuka minta update pembaruan jink!?,1,0,,2024-05-17 14:17:38,,,
500,b5aca959-c139-4721-8833-a1b28ad79f43,ꦫꦺꦤ꧀ꦢꦶ ꦫꦶꦱ꧀ꦮꦤ꧀ꦠꦺꦴ,https://play-lh.googleusercontent.com/a-/ALV-UjXM65DtBgPy1KapzN0Wsa89TkziXoBDDAts_e84ZdkLvZZdGr6iWw,"TIDAK BISA MASUK MAU DI APLIKASI ATAU PUN DI GOOGLE CROME SELALU GAGAL MULU!!,KATANYA DATA GAK ADA,PADAHAL KALU DICEK BISA MUNCUL!!",1,0,1.4.0,2024-05-17 02:31:25,,,1.4.0
501,a29c750f-bd1e-4581-9673-ed57daa48ebb,Kana Namud,https://play-lh.googleusercontent.com/a/ACg8ocL3vhvlzYE0z3eZKgrH0lYMBxNmCC5KYrXv1rk3F0XwvLoX4w=mo,Aplikasi yg sulit Login aja susah 👻,1,0,,2024-05-16 12:21:16,,,
502,a9c264aa-9d16-4dee-ad9c-216f769d6040,F MZ,https://play-lh.googleusercontent.com/a-/ALV-UjWewvErAhya9HEsFlDCMHlvqzTtSgVQm-kr-oLtUcH3e3czVTs,"Baru juga download & install, Cuma liat muter2 doang kwkwk",1,0,1.4.0,2024-05-16 10:10:17,,,1.4.0
503,69bf6e36-9331-4775-81df-b90f25944b23,Eko Irwanto,https://play-lh.googleusercontent.com/a/ACg8ocJuqfQjJFZyFqvC7H4hO5_GERmTezfjyBA0aMJtEWQISk44dmQ=mo,versi terbaru mempersulit pengguna untuk lapor perpajakan tlg di kembalikan saja ke versi lama itu lebih mudah karna menu yg di perlukan muncul semua,3,12,1.4.0,2024-05-16 10:03:19,,,1.4.0
504,edb71555-5f0e-4ccf-83a8-3d1d39ae4917,arif annasih,https://play-lh.googleusercontent.com/a/ACg8ocL1S7mJuqwJW0xKzAZGnEpkfgbqQLy7GG7jsjKIwqCdZEZYvQ=mo,Sudah membuat kode billing. Namun ketika akna membayar. Kode billing tidak ditemukan.,1,0,1.4.0,2024-05-16 09:40:11,,,1.4.0
505,2832a47f-2632-40cc-ad3d-0443efd17966,Mawan Mawan,https://play-lh.googleusercontent.com/a/ACg8ocK5aJPq_jHibOs7mfTdVVttYyZJsrBViwN16udjVST_sWakNg=mo,Belum dipake dah minta update aplikasi tolol pemerintah dongo semua tua bangka tolol,1,0,1.4.0,2024-05-16 09:11:57,,,1.4.0
506,46af8d7b-b8bf-4ddc-a4a0-d48a5eb5062c,kek kikek,https://play-lh.googleusercontent.com/a-/ALV-UjXwjvY4LxfqZOXd1dNTsn8df3-iLXdNPYaoxcjvq7z9_qKbbw,Susah masukkan kode captcha Abis pulsa gua karna refresh hp minta kirim kode validasi,1,0,1.4.0,2024-05-15 20:52:54,,,1.4.0
507,7956cf07-d3c3-44b8-9d28-721c1228787f,AKBAR AIDUL POETRA,https://play-lh.googleusercontent.com/a-/ALV-UjURCl0PrILQHxTUxhXc1dvI56nWYl2p-45BoLh66Xd98D20yMjf,Ini apakah bisa diakomodir jika lupa efin?,5,0,,2024-05-15 11:16:19,,,
508,84fdae96-a644-4dbe-8a9f-d50aafa76300,Abdi Beh,https://play-lh.googleusercontent.com/a/ACg8ocKWMO2MgPU4rE0o0hzfNFoSHDrNcNLc8O36CdSbzGpJeE454A=mo,Mau daftar saja susah 🤦,1,0,1.4.0,2024-05-15 01:17:53,,,1.4.0
509,b5f27a8d-08df-4823-a404-02dd074bea7a,White Commander,https://play-lh.googleusercontent.com/a-/ALV-UjXHfCqstOVfnNk5nfykJN-ld-HUk4g49QnArtXgLXfC14MVkfY,"Aplikasi payah. Website payah. Query validasi data juga payah. Scrum master-nya tolong totalitas dong. Bisa2nya NIK & KK dibilang gak terdaftar. Trus kita bisa bikin NPWP dan terdaftar di Disdukcapil gimana ceritanya? 🤦🏻‍♀️ Udah update, minta update. Ditungguin, malah splash screen dan blank. Cape pengguna dibuatmu. 🤦🏻‍♀️",1,79,1.4.0,2024-05-14 21:55:10,,,1.4.0
510,00762a6c-40bd-49f0-8f29-fb3af729f881,Subhan Malik AL-boghory,https://play-lh.googleusercontent.com/a-/ALV-UjWx1n-4zbzRAU0SDfDQCQuIYmeCwCowcu-R6BgCJpgzSV3cLjxb,Nyari domisili kurang lengkap masa iya domisili saya tinggal kaga ada apk busuk,1,0,,2024-05-13 10:06:40,,,
511,c9e77f33-5c81-4ade-a276-946d0a1c6078,Anak Arab,https://play-lh.googleusercontent.com/a/ACg8ocJJ6cwRyDPOulw0DQgbUia20v-tvSSWae0_EIuNNjmIFoG_WA=mo,"Customer service payahh, masa iya cuma salah email dan pasword bisa keblokir akun... Di suruh daftar pake email baru lagii. Nanti keblokir lagi karna salah pasword dan email... Teruss gitu sampe 1000 email",1,0,1.4.0,2024-05-13 08:37:21,,,1.4.0
512,172e3c5b-5c55-410c-a0e7-e800e3a11e1b,Azni Seke,https://play-lh.googleusercontent.com/a-/ALV-UjXYgrOTh-X2uUOrUIXoBJ4PVYkPo1RgvCU6r44P-PaVigmXDg,Perentiah 4njing habisian duit negara buat aplikasi kayak t4ik,1,0,1.4.0,2024-05-11 16:24:05,,,1.4.0
513,68635652-efda-4c6f-b9fc-8aec7072958e,Farid Nugraha,https://play-lh.googleusercontent.com/a-/ALV-UjWaMqMWZFdxjg965JKT9e7w2OsSm5ktc8XC6dgHHuWwDzFdzFM,hapus aja ini aplikasi dari play store,1,0,1.4.0,2024-05-11 14:11:09,,,1.4.0
514,209fc084-0170-4a21-895d-94d22b69c1b2,0ryza,https://play-lh.googleusercontent.com/a-/ALV-UjX3i0VWDJaoG-38jN89L8ImoRC2a7ZjENSc3YkwHd57ELSN1CYX,Nyusahin,1,0,1.4.0,2024-05-11 14:10:47,,,1.4.0
515,069368f4-e932-4014-ba2b-261a0d14ad8c,Slamet Rio,https://play-lh.googleusercontent.com/a/ACg8ocK6MR3lWkc1ylKZygqN_1SKIpj0pLDGFeHtyrsbVurOwK85t-A=mo,Padahal aplikasinya diawasi negara kenapa kualitasnya seperti ini?,1,0,1.4.0,2024-05-11 00:03:49,,,1.4.0
516,1d29c9d5-0f5f-413a-8b48-cbf45286cdbc,davit martin,https://play-lh.googleusercontent.com/a/ACg8ocJZoSLB8VG0MCOQQxu5TBPuzUh-dOJyHgm942LpLx9FWNhz0g=mo,aplikasi kaga berguna pulsa udah abis 5000 kaga ke daftar² buat apa ada aplikasi ini kalo kaga berguna,1,0,1.4.0,2024-05-10 20:28:25,,,1.4.0
517,1fca0fa5-34ff-46b4-a02c-22047910dccf,Rizhal Worsnop,https://play-lh.googleusercontent.com/a-/ALV-UjX4R4a_Kj4NvtCUYnzNDA5AXGyS-cuvgHpk4NES2EEdOpOMZ4PlFw,apinya error ga bisa di buka,1,0,1.4.0,2024-05-09 16:33:45,,,1.4.0
518,84576f9c-ec20-403f-8735-1e7ad682f95a,Kusnadi Kusnadi,https://play-lh.googleusercontent.com/a/ACg8ocLwQ3mktu2upnyfPsNyRRpLxaP-AFBDAft_iv3MC3VjcH8pEg=mo,Top..aplikasinya,4,0,1.4.0,2024-05-09 15:57:35,,,1.4.0
519,e1a029ad-2962-4421-9d1b-d20e3d75a052,Hideyashu Yamari,https://play-lh.googleusercontent.com/a-/ALV-UjVi1rR04els6v1o4tFCrK5s_sbKcbXjp81ZPJhPKfWQH10CyYjq,buruk sekali.. eror.. live chat pun gk bsa,1,0,1.4.0,2024-05-09 08:15:39,,,1.4.0
520,9da237ff-6d2d-4eba-82e9-e560c370752d,Rahim Timbau,https://play-lh.googleusercontent.com/a/ACg8ocIJHU-1PP-R2-bpGVbZyo9ASwi2BNEP220tqYD3cR69Vr9z6A=mo,Membantu,5,0,,2024-05-08 18:29:52,,,
521,d5f80e6e-9f6f-48a8-bfd9-71af8a2b3340,Fery Suharjono,https://play-lh.googleusercontent.com/a-/ALV-UjUbehcO5zZkNNJodDxzpi7R63vqQfLnd6zn7FqK-YA5aSoiLqSBXw,Sesuai data,5,0,1.4.0,2024-05-08 10:14:17,,,1.4.0
522,f8eed8be-a78d-4b5e-9f7f-ab44f9055c89,THE HUNTER,https://play-lh.googleusercontent.com/a-/ALV-UjULmRqxaot7M_oWJsP0t8OsznVaT5liRk90_6JxE566-5Pmbv6k,Percumah kita mau taat pajak aja susah birokrasi ribet aplikasi lemot buat pengurusan gimana negara mau makmur,1,0,1.4.0,2024-05-07 14:32:07,,,1.4.0
523,80f49821-c26c-45db-9c29-2661756f0d0c,Tea Rekt,https://play-lh.googleusercontent.com/a-/ALV-UjUUvf4_CCqMPESMJUOIokI5d1xhI-fRtSxJx2zDANhZeEYeJ15i,"Otp sangat lama, waktu sudah masuk proses verifikasi gagal. Verif efin sudah berkali-kali dicoba tetap gagal verifikasi. Ujung-ujungnya ke kpp juga ini. Buat apa aplikasi dibuat tapi tidak untuk mempermudah",1,82,1.4.0,2024-05-07 11:08:20,,,1.4.0
524,83161411-9f21-4b2f-9537-10a36e91c05c,Isal Hakim,https://play-lh.googleusercontent.com/a/ACg8ocJz9UmY-2nFWe0CYWej0TLiuzE-h5QyGXdIrUANIQJiZSH86A=mo,Ok,5,0,1.4.0,2024-05-07 00:11:17,,,1.4.0
525,f92464cc-4165-49df-9d9b-23ab36a28928,Reva Alamsyah,https://play-lh.googleusercontent.com/a/ACg8ocLAPncswSmvz2Ol5lEkyhptPiINeCySGAkZ2IrBq3AjQMIgfA=mo,verifikasi sms ga bisa apa ga punya pulsa???,1,0,,2024-05-06 15:06:33,,,
526,d861eed5-9b8b-4157-9f54-839ca84550f4,Mahfudin Setiawan,https://play-lh.googleusercontent.com/a-/ALV-UjX2meyq38rYLJrWbvdWQo3lZd95mhvCEJu1ebUGAaQrjxB2HO2P,"Pagi tadi ke kantor pajak buat ngurus aktivasi akun, setelah selesai nanya ke CS nya soal login aplikasi ini dan CS nya bilang ""kita"" gak ada aplikasi kaya gitu pak, ""kita"" base nya pakai website, jadi mending uninstal aja. Baca2 komenan review juga mayoritas negatif, takut input data2 malah disalahgunakan",1,14,1.4.0,2024-05-06 12:12:47,,,1.4.0
527,792fbd90-911a-4c4c-9e2e-e798ed21ca7d,Ahmad Mujtaba,https://play-lh.googleusercontent.com/a-/ALV-UjXBieNXfTDd5s83FDVLuiT14pTwzwyuy8yAQ861ZwV2hPSqw075Cg,Gak guna,1,0,1.4.0,2024-05-05 20:29:38,,,1.4.0
528,b4c99cd1-9b5b-42c7-8aa4-28d481100b42,T7 GAMEE,https://play-lh.googleusercontent.com/a-/ALV-UjX4UDCEAotQMLTqKjHiQx3xVYrpWF_aShNpc0RVKqD7kT-u_V2b,aplikasi paling gk berguna,1,0,1.4.0,2024-05-05 10:57:40,,,1.4.0
529,4ac9fec8-3c57-44dd-9604-e70d32026260,atim gore,https://play-lh.googleusercontent.com/a/ACg8ocKiI8DxiaYccuzMFreGO6bFAIVeFPQytaw0qYHb3OJMM_LANw=mo,sengaja download biar kasi bintang 1,1,0,1.4.0,2024-05-04 22:52:05,,,1.4.0
530,ea6d0ca5-27aa-46f4-acc2-4eaa45fe70c6,Reza Fahmi,https://play-lh.googleusercontent.com/a/ACg8ocJQF9NKBLY9CWU5bra_XhutO6FpvNdyIDrg0R1z1lrt5fYpdQ=mo,"Aplikasi g guna,, kyk kantornya",1,0,,2024-05-04 14:55:35,,,
531,13f6ae2c-aacb-40b7-b00c-850890918221,Aster (KIM Sara-Silver),https://play-lh.googleusercontent.com/a-/ALV-UjUYzMM__g9wy2vIntQOjTb7ysP21TujLHueS3ucov1MrmtCIEPC,"Web nya aja ancur ancuran bikin aplikasi, orang orang Pajak tu ngapain aja si, sampe kena hujat sana sini, benerin dulu web nya, bikin app mah buat pantes pantes doang,dikira jadi keliatan keren apa gimana web sama app nya ga bisa di pake,",1,0,1.4.0,2024-05-03 21:06:48,,,1.4.0
532,8ac6f9fc-bc38-450c-858d-751e36a02526,Mas Ugi (uGi),https://play-lh.googleusercontent.com/a-/ALV-UjVe0OySdtVDk4fld6WJilf2QGBFSxhz357RJa0SPWHqznJzjR2o,"Baru juga download. Mencoba daftar NPWP baru, tetapi tidak ada email yang masuk. Baru langkah awal sudah buruk 👎🏿",1,1,1.4.0,2024-05-03 11:09:37,,,1.4.0
533,d69344e5-e89f-4cca-af96-fa0394adb9b3,Indra Nugraha,https://play-lh.googleusercontent.com/a/ACg8ocKHDiA0JmNESEwxTjGsWIis0SD-oQWCuOJmiKH3n3QxaP2XWA=mo,"Baru diinstall, langsung nongol pop up apk harus diupdate dan apk gak bisa digunakan",1,1,1.4.0,2024-05-02 23:50:02,,,1.4.0
534,e9554320-3dba-4a2c-b86a-3aab465c4605,Nime Art,https://play-lh.googleusercontent.com/a-/ALV-UjX4pulcR2RTu-cWEutoQsgg0jtzkvh1I41hgG8CbxPU2vNkLlU,"Fitur yang sangat buruk, tidak di aplikasi atau pun di website semua ny buruk!👎",1,1,1.4.0,2024-05-02 22:54:03,,,1.4.0
535,56ae8722-90c8-4997-8bb0-7268a5b7fa64,Koes Hardjanto,https://play-lh.googleusercontent.com/a-/ALV-UjWy6rFNFX0oeJysflMQ8tn_tQpk4oRUfYf7MUJomx1ftJsI95N6kQ,Bagus,5,0,1.3.0,2024-05-01 17:05:48,,,1.3.0
536,3a4ba664-dde3-4c80-a248-e445d24906c3,BotakWibu channel,https://play-lh.googleusercontent.com/a-/ALV-UjWbeQufezdM8QOlChfGurqw5GToQpA9W6TwYzU_cL6HsGbjCfmS,"Ah, tolol anying",1,0,,2024-05-01 12:17:48,,,
537,5bd20fbc-16e9-41ab-a0ad-62dddd61ef15,Joe Rizky,https://play-lh.googleusercontent.com/a-/ALV-UjXJaKQsvykDZoQygpUWVtaTzLM-wIWpkXd60_VUAQunzLz6drSA,APK BUSUK MAU LOGIN AJA RIBET,1,0,1.4.0,2024-04-30 17:22:49,,,1.4.0
538,e091ff74-3344-49f6-ba55-ccc858b9d959,Suly,https://play-lh.googleusercontent.com/a/ACg8ocLKgh8b0d0U7sD6x9WV5KJU-OpLzsr-h1alR9Q86GyDN60C6yo=mo,Aplikasi gak guna ferifikasi data muter2 gak jelas minta efin pun susah gimana mau taat pajak kalau semua dibuat susah.,1,2,1.4.0,2024-04-30 08:39:02,,,1.4.0
539,96a46986-0046-4782-8888-fb10f9bbc4df,XTREME gaming,https://play-lh.googleusercontent.com/a-/ALV-UjWxAgWxPPKZVwEg5J9X5VYDPLOcxZlw9vPPRtNAFQRJHxY0tjA,Ga becus,1,0,1.4.0,2024-04-30 08:08:32,,,1.4.0
540,1c922f14-d594-47ca-be89-21ef3f2d4095,Puji Sopari,https://play-lh.googleusercontent.com/a-/ALV-UjW_bdIjxUWZ4nmGQ6Ued36qnPX86kKm76t-fnYkaXxBMONGrgO_yg,Gak guna ajg lapor spt ttp lewat web,1,0,1.4.0,2024-04-29 14:50:41,,,1.4.0
541,b4aa2441-a5ef-495d-beab-16f055c3b193,Dayat Farezza,https://play-lh.googleusercontent.com/a-/ALV-UjXjL7lTACX3Pf56vGjZZiB71kPgr8MVQO9aiqnfy2URq750xoVx,"Datang ke kantor pajak langsung malah di suruh daftar online, giliran daftar online malah ribet. Terlalu banyak buang waktu",1,1,1.4.0,2024-04-29 12:48:44,,,1.4.0
542,9e0570c1-8155-464a-9699-ba70e6a6753c,Rizky Darmawan,https://play-lh.googleusercontent.com/a/ACg8ocIPqsdQpgO-se_zA-WOANVoinmdztPSsT_pH_gxV4nFIFckZQ=mo,Servernya lah tolong diurus,1,0,1.4.0,2024-04-29 10:18:41,,,1.4.0
543,3c83388f-87d6-4398-851a-e0ebbc878593,Hi hihe,https://play-lh.googleusercontent.com/a/ACg8ocLwJnFxsfwLwClMOHdTgjvVg6OYl_XNujXYkhsaiwhL5GAi8g=mo,Buat online tp efinnya disuruh dtang langsung sama aja nggk online duh jaman dah online tp pelayanan kek jaman dulu,1,0,1.4.0,2024-04-29 09:25:52,,,1.4.0
544,2e8c17b7-976b-4e3e-af43-fbda2940ca4d,Gina Siti Hidayatillah,https://play-lh.googleusercontent.com/a-/ALV-UjUgTnK1xI8n1nXZxwFj3TzBGpc4r07rf5AUysEkiRjMNLPqfDs,Good,5,0,1.4.0,2024-04-29 06:49:13,,,1.4.0
545,d3f917de-f51b-4f8b-9e93-7daa3bb3afaa,Fahmi Khusaeri,https://play-lh.googleusercontent.com/a-/ALV-UjVwjM6FregFDmR25xma1OZLfIPlA9yMtJONHQfCKZhhIvHEtKrt,Ga bisa di buka,1,0,1.4.0,2024-04-29 05:48:19,,,1.4.0
546,53a1882b-037d-4791-a850-82ec6fdcd545,gogele 100,https://play-lh.googleusercontent.com/a/ACg8ocL2DJbKc9DnZb7mtba7MJgjWVktoZ-G8fvJDi9cduO5s02BNQ=mo,Sang membantu,5,0,,2024-04-29 00:26:07,,,
547,758e51d1-94aa-4283-ae52-8c82f075d81d,Muhamad Fikri Ramadhan,https://play-lh.googleusercontent.com/a-/ALV-UjW3h_f-C-Hrd351iRyw1SoeQZ7uRyMmJD4QWaWTMmLGKXfQTpg,Aplikasi ini sangat tidak membantu sama sekali,1,0,1.4.0,2024-04-28 23:11:29,,,1.4.0
548,ef36c509-bf5f-470a-bd4c-51d8d5ffb07f,Erwin Syahbana,https://play-lh.googleusercontent.com/a/ACg8ocJ00N0Hq3tAsOTBfSpR7i5fZjeDZ5Bgmhx3JXtgcYUpnPDysA=mo,"Perpindahan antar menu saat di klik memerlukan setidaknya 2-3 detik untuk ditampilkan, harusnya aplikasi ini gk lolos ujicoba pas mau launching,melakukan pendaftaran / lainnya kenapa harus pindah ke via website? Terus fungsi aplikasi ini buat apaan? Buat di putar, di jilat, di bakar kantor pajaknya? Itu dana gede kemanain? Bukannya upgrade kualitas manusia, malah di pake beli Rubicon, nyewa LC, nikah lagi sama LC,elu nagih pajak puluhan tahun dan jutaan warga, masa bikin aplikasi model Majapahit",5,157,1.4.0,2024-04-28 20:54:19,,,1.4.0
549,2f5e3432-5d1b-4c4c-b8f8-86964c6c7bf3,Reynaldo Reynaldo,https://play-lh.googleusercontent.com/a-/ALV-UjXWlShjjqhRz2a9Ka8ezqKxx2ptoPeXi-2ARKU2ceaYSf36HMU,Aplikasi tolol,1,0,1.4.0,2024-04-28 12:51:30,,,1.4.0
550,9b30f7b9-02e5-467a-ae43-d036771a8838,Purger of Heresy,https://play-lh.googleusercontent.com/a-/ALV-UjV9ncOtJDo7w9WSrh3YcLIbeQEChMFc9gpUJ5p-TawRkms-aeiP,"Aplikasi Negara Dibiayai APBN kok sering Eror/ Bug Malu maluin 😂 Sesuai kualitas Pejabatnya😂 Contoh tu Aplikasi PLN mobile Bagus and User Friendly, lah Ini Urusan Pendapatan Negara secara Global Makro All sectors malah Eror an😒",2,0,1.4.0,2024-04-26 20:41:36,,,1.4.0
551,b427164a-5dc6-4ad7-8cdf-b96466a6ce93,Enda Sudarna,https://play-lh.googleusercontent.com/a-/ALV-UjXL1MZumHK3cLodypH5jVwBUcD8YCCvRbVv3l3zjFOb7mCi-Zk,"Terima kasih sekali sangat membantu ,live chat nya juga cepat aplikasi berjalan lancar. Sebagai perantau yang pertama kali juga lupa efin badan bingung banget karena beda sama lupa efin pribadi dengan live chat sangat terbantu makasih kak satria walaupun aku bingung banget tapi Alhamdulillah muncul emil padahal live chat nya keburu berakhir. Makasih pokonya sehat selalu pegawai dpj 🙏🏻",5,3,1.4.0,2024-04-26 14:56:19,,,1.4.0
552,5cad48ce-5d7c-4e36-89d2-46dce1a3fff3,09. Alung Fatwa Gotawa,https://play-lh.googleusercontent.com/a-/ALV-UjXYT-fCYUV9cF_WB2Kzqxh3dKbRM7Kvh7gmcuMVQl-XsLCFfnFA,Apk macam apa ini! Login di website bisa tapi login di apk gak bisa!!,1,0,1.4.0,2024-04-25 20:41:46,,,1.4.0
553,69ecaf02-5241-4639-abe6-bf5a87b07b43,MEFI CHANNEL,https://play-lh.googleusercontent.com/a-/ALV-UjWnEJ6Btr7ImBtwiHO5zZAoE7bmIvNRjBFPb7tKDy-1EY5yCXN0,System konyol tidak ada satupun bintang 5 .,1,0,,2024-04-25 14:09:04,,,
554,14e66a73-dcae-4069-a321-cccdcd9594ce,Sundra Murti,https://play-lh.googleusercontent.com/a-/ALV-UjUBiI1GMEOJL_6pgwsXvXQLW2pKmKeEu2xJlXcgof40UEkeXOs,Mantap,5,0,1.4.0,2024-04-25 13:52:34,,,1.4.0
555,a97b6c98-c444-48e0-a336-0a1f9f4b9d2e,dede ahyadi,https://play-lh.googleusercontent.com/a-/ALV-UjUKY2j2gDy0aiXi9iJLFmZc8g2tZvxqR9DtbCt9bQdrLA0ITvA,developer nya keliatan banget ni aplikasi ..sengaja mempersulit orang yg mw daftar ...stelah isi data mw ke selanjutnya eh tombol nya di umpetin ...PEMERINTAHAN EMANG SELALU BEGITU ..,1,7,1.4.0,2024-04-25 00:33:05,,,1.4.0
556,383a7790-7959-4e1f-9309-8a9d33217f86,Okky Rahmadian,https://play-lh.googleusercontent.com/a-/ALV-UjUjBQ16Ff6M33wiODbMPVjC1DeWqIuXdg1jcSQH4Q3a25GvgvXQ,Mantap,5,0,1.4.0,2024-04-24 13:08:48,,,1.4.0
557,2e910561-b26a-4cf2-9cf2-402ddac0cccf,Muhtar Riezal,https://play-lh.googleusercontent.com/a-/ALV-UjVAHAOTO4WE4VZoJUQtGLv_8TT4-2BC6_dPwhbovTd1IhudJXZX,Login sering bermasalah. Aplikasi ampas.,1,0,1.4.0,2024-04-23 13:08:37,,,1.4.0
558,0189d784-13a6-4307-8f90-b552c1d88232,Muhammad Yanuar Haditomo Hadiko,https://play-lh.googleusercontent.com/a-/ALV-UjUft1WcNIyb8x9GRPCYzsh-uB5d1KrYmcATHwmOf7UZK_s-vJ9L,"Pengiriman kode otp ketika melakukan pengajuan pupa e-fin sangat lama baik melalui sms maupun e-mail, padahal pengiriman otp melalui sms dikenakan tarif.",1,1,1.4.0,2024-04-23 12:03:20,,,1.4.0
559,6441212e-422b-4aaf-a777-c91c7a3380c1,Masbaron Baron,https://play-lh.googleusercontent.com/a-/ALV-UjWrNS-8SCCTXSguW16Ez9hL0PtMA6J_M__VIEZktekmwfrwyD4a,Bagus..pelayan cepat dan sangat membantu..memuaskan..good job,5,0,1.4.0,2024-04-22 18:44:23,,,1.4.0
560,9d5e976f-5235-403b-9f61-794ce01c6e6b,Taufik Firdaus,https://play-lh.googleusercontent.com/a-/ALV-UjXOMXdthROfeTZ3IH_PfJy1fheY1Q7X5xHb5TYtg_SPN29Rz4c,Mau login aja susah wkwk,1,0,,2024-04-22 16:41:39,,,
561,e6b4bf87-9e19-4252-97b2-f39f396ff7a5,Hanafi Nafi,https://play-lh.googleusercontent.com/a/ACg8ocL-CDyGJHX5ixOHxD4JKBwVCj1sHrgOIegnJ8zcwL1ARZuPPg=mo,"Saya daftar npwp Krn perangkat desa kantor lurah yg nyuruh, Krna d iming2 bantuan pokir dari caleg Jadi saya susah dapat bantuan pkh, Gmna cara nya ini pak/ibu, mohon bantuannya?",2,0,,2024-04-22 05:38:59,,,
562,b59d58fa-b8f7-4f63-9046-2ee8138f85bf,Sam Samsudin,https://play-lh.googleusercontent.com/a/ACg8ocLQB8IcbgZVi3o74ErtnvyhRyydBPQOw9NphA13FhcPZqHSOQ=mo,Sangat bagus,5,0,1.4.0,2024-04-22 01:53:49,,,1.4.0
