,reviewId,userName,userImage,content,score,thumbsUpCount,reviewCreatedVersion,at,replyContent,repliedAt,appVersion
947,e3a78079-e765-401f-b9fc-55e0bb3c127c,Kaserin Kaserin,https://play-lh.googleusercontent.com/a/ACg8ocI5HkVnei-xF1dqoJ3JXhHhZ5J9ryCFfprqJ5cFLfPn-Ji-Xw=mo,Katanya pemerintah memudahkan rakyat tp susah amat mau daftar aja gak bisa di klik gimana rakyat mau percaya dengan dektorat pajak,1,0,1.4.0,2024-03-06 12:03:41,,,1.4.0
948,e69f667f-7f58-41f0-99ea-ef38dee98797,Harry Fathan Arkan,https://play-lh.googleusercontent.com/a-/ALV-UjXGn1FssZTWcUrCl2fAP9twIswE7IGDyzqcmQ-zi-dvuGW02ScZ,Nomor NPWP sudah di dapat. Cara mendapatkan nomor EFIN bagaimana? Mau buat laporan SPT setiap tahunnya jadi sulit. Karena belum pernah mendapatkan nomor EFIN.,5,0,,2024-03-06 10:45:04,,,
949,a9ef27bf-dbfe-49b0-b6be-7914f0073858,kereta mania,https://play-lh.googleusercontent.com/a/ACg8ocIJ4ohMhtL5iOcfS63ERSHABzfKRgEgmUjTjY09SUEKctWrvw=mo,"bayar pajak aja ribet dah, wakanda.... wakanda....",1,0,1.4.0,2024-03-06 10:02:46,,,1.4.0
950,e6386ae9-de1f-46f4-ba89-5c4ae18a0db9,Edwin Ferdiansah,https://play-lh.googleusercontent.com/a-/ALV-UjXg9Uet-kSkR3tkdm8rLVFh1zauLwTXXJwKx5i6VnhMcvOHW07k,"Aplikasinya eror,sudah mengisi data 2 kali langsung log out sendiri",1,2,1.4.0,2024-03-06 09:47:30,,,1.4.0
951,8fd1c9f0-6275-4b94-85de-bac57aec93ef,Nunung Nurdjanah,https://play-lh.googleusercontent.com/a-/ALV-UjVFkOJ5m_lcP2FACAkEP71FT5qwxErb___AOvToO_qTaskTQjw,Great good...!!!!,4,0,1.3.0,2024-03-06 02:07:05,,,1.3.0
952,a792aae7-c4d7-4b1a-a5f7-46bc5e93b1ed,aditya ismail,https://play-lh.googleusercontent.com/a-/ALV-UjUKHT2UifLF_iWr4iHGjcw9LQhEFoZH91QnCiCpKAvLptl_Q_UqQw,"Lupa nomor efin, sudah ikuti pengisian sampai tahap kirim OTP berkali-kali via email & sms tetap tidak dikirim nomor EFIN nya Email manual via lupa.efin tetap juga tidak dikirim padahal sudah mengikuti arahan dan format, mau lapor spt aja kok nyusahin gini..",1,101,1.4.0,2024-03-05 21:53:56,,,1.4.0
953,c7fb888b-5e17-43c5-b868-4a599543e8da,Adit Raink,https://play-lh.googleusercontent.com/a-/ALV-UjXU_3Z6AY6F6E01NWz6mMp3uH5eHSA4SrSHEf_aOX4YQbC0B_NN,Hapus mending nih applikasi Pakai browser aja ribet ini pakai bikin applikasi... Kalau susah buat daftar online Lebih baik gak usah buat applikasi...,1,0,,2024-03-05 19:47:20,,,
954,5ed825c7-3f10-4202-bea5-8f1aad15cea5,Okiprata Channel,https://play-lh.googleusercontent.com/a-/ALV-UjVlA66ZZ_P6jkc_Y6-vWtxUUKuOBAEu-CdzGIdI2SNc3MWvUQKQ,Aplikasi tdk mendukung,1,0,1.3.0,2024-03-05 18:17:35,,,1.3.0
955,5185a7ef-8c7b-43a3-b469-5b281efe4662,Hardy Christianto,https://play-lh.googleusercontent.com/a/ACg8ocJUZrH2ErJwHtPaUQJ2NSluMmhiRSvqQBkzugj2xYWmh2IG6A=mo,Bagus,5,0,,2024-03-05 17:14:03,,,
956,aa5ee95a-a2c1-4bab-ab85-ca6db373b343,Obie Pramana,https://play-lh.googleusercontent.com/a-/ALV-UjXHkgdA_6epKoE2GeeDltEpc3uzDuRSD9cnfp6GvrGBOwZ5Dlyj,Aplikasi sampah.paswrd udah bener dikata salah.padahal di website bisa.klik lupa password jg gak respon.buang2 kuota.buang2 waktu bangke beud,1,0,,2024-03-05 17:04:06,,,
957,8b6939a0-8eb5-4c77-9e5c-27e3c01d9ba5,Curan Mor,https://play-lh.googleusercontent.com/a/ACg8ocJgs3v6i-tlocQ_BcqmEi4MIuMsXAikX9H_r6aIpmvy3s2CEQ=mo,Sangat mudah bagi saya yang lupa efin cok,5,0,1.4.0,2024-03-05 16:45:07,,,1.4.0
958,3868abc3-7025-4e37-951e-7ddf18e785d2,imam sutanto,https://play-lh.googleusercontent.com/a-/ALV-UjUkIlbOWLfj1L2n2R6JivVOL0_cs-Kuvyc8guYzVg6hu1HeDYzf,gak masuk masuk otp reset paswordnya,1,0,1.4.0,2024-03-05 16:33:35,,,1.4.0
959,45dbbe10-b24c-4a61-b5c5-8c7bcfd0c08e,Bang Yo,https://play-lh.googleusercontent.com/a-/ALV-UjXu4MkEpo2VXBpJTzDNhI0zBt6-8JZnPsT_xtyZ3-c4oPYv6Qo,"Aplikasi bohongan masa baru masuk restart terus, mau masuk aja susah apa lagi isinya",1,1,1.4.0,2024-03-05 13:44:56,,,1.4.0
960,1602f916-1aa7-4670-a1db-a882582f41ce,Denih Shan,https://play-lh.googleusercontent.com/a/ACg8ocItR6Pd8VaXQxqoUHJfUHBNJAAyxVi_49OxupLcp4KL9CWdyg=mo,aplikasi ini membantu jadi kita tidak perlu ngantri berjam jam dikantor pajak,5,0,,2024-03-05 11:59:30,,,
961,ec2cb81e-78ba-46f0-8aa1-4376f57ee21b,mvp lover,https://play-lh.googleusercontent.com/a-/ALV-UjWgPummiQUilM5sVm75PUT_bQtGQ6vfr4v8QiEJpg025oCzKPI,aplikasi ga bisa dipakai,1,0,1.4.0,2024-03-05 11:35:55,,,1.4.0
962,aa49db57-69d0-42c2-85ac-5124fdea03d9,Arif Budiman,https://play-lh.googleusercontent.com/a/ACg8ocLepSWwcuFKFzztF-pXiXkiKyK2nzoHeEmP2YCkcROx1Aj7cw=mo,"Uninstall....harusnya mudah,malah ribet, banyak nge-bug aplikasinya",1,4,1.4.0,2024-03-05 10:21:10,,,1.4.0
963,653183b6-7f11-478f-9f50-605df3477643,NeLiel toram,https://play-lh.googleusercontent.com/a/ACg8ocJqJUvvKoTmpnt_4nhpLJxevyscKKj3EEX_7ibzotfBuQLDvw=mo,"Ribet minta no efin aja di persulit, udh bayar pajak suruh laporan pula ke kantor nya langsung apa lah guna ini aplikasi, tidak berguna",1,0,1.3.0,2024-03-05 09:32:16,,,1.3.0
964,283e9845-c246-4112-a8cf-e61181c701b5,Eki Kopi,https://play-lh.googleusercontent.com/a/ACg8ocJMAMQCqrz87NjYgyAp4-FSOkIlQgFYkxz3t-JUKedlUasaKw=mo,Sangat bagus dan membantu,5,0,1.4.0,2024-03-04 20:53:45,,,1.4.0
965,5c8d15f2-6cf7-4508-ad35-a632912e0958,Pri Yanto,https://play-lh.googleusercontent.com/a/ACg8ocLLr1ho3FDaPeajfBnCEhZ3ES0Hr3h72ycRF234VmSotBtd8A=mo,Lebih mudah menginformasi kan pajak pendapatan,5,0,1.3.0,2024-03-04 20:14:00,,,1.3.0
966,c643e569-c1cd-4156-a1af-bfb7c1a89927,Indera Jid,https://play-lh.googleusercontent.com/a/ACg8ocJCsl9XZgsFsH813mLo3FKVRu0jogWlBykHuoZGT20rFnxA1aHl=mo,chat pengaduan susah banget 😏,1,0,1.4.0,2024-03-04 19:16:34,,,1.4.0
967,38fa42be-1403-48d3-a500-628c203a2b42,Arif Rahman Hakim,https://play-lh.googleusercontent.com/a-/ALV-UjV8IGG5pxpapZQdrCf_faCtnLFFsY08wMnqH7TX06osA7QU-4qr,Sippp-Mantabbbbz,5,0,,2024-03-04 17:42:20,,,
968,d43ab05e-ae69-4d45-8d70-a3cd2d680c62,Windi Fu,https://play-lh.googleusercontent.com/a-/ALV-UjWmZTit2XhXEr8MjDDQM9IDClw3YXvDnKu11O5EAlQOqGd3082l,Di update malah lemot bikin geleng2 kepala,3,0,1.4.0,2024-03-04 17:01:48,,,1.4.0
969,18be0509-74ee-44e6-8f61-91fbf08a1b78,Wulan DA,https://play-lh.googleusercontent.com/a-/ALV-UjUqoctZs-3xGDTqqnAAkmpSSsCtvKPYt6LQcwPvdwL9npK9KLcM,"Payah! Berkali² berusaha login susah, mqu klik daftar susah, lupa sandi susah. GA BERGUNA APKNYA. ADA APK CUMAN BUAT NGABISIN ANGGARAN ENGARA DOANG. ISI YA GA MUTU DNA GA GUNA.",1,0,1.4.0,2024-03-04 15:49:05,,,1.4.0
970,fda1bfc8-2e14-4ee7-bf38-0f1ef1fb2089,Faisal Marzuki,https://play-lh.googleusercontent.com/a-/ALV-UjV9U1TxTd7rJeB5zxAZkUr4d2Kb4zCdCCalWsRFU7V0NDHf5XkQ1A,Mantap,5,0,1.3.0,2024-03-04 15:34:16,,,1.3.0
971,fd8f6ba7-0c23-4d82-bc0e-ef6d70e937b1,Afifa Seina,https://play-lh.googleusercontent.com/a/ACg8ocKam67FAykbkWPF-kODB89i4mtIfKe68rYdYuV_xvVYyTzryg=mo,"lelah banget mau tanya fiska doang, ghosting mulu! Bad!",1,0,1.3.0,2024-03-04 13:07:53,,,1.3.0
972,631759d7-4a4d-4894-b455-447765e6fb3f,Arif Rifqi,https://play-lh.googleusercontent.com/a/ACg8ocKUYF1b6bLM8QnHbJ80b33Pr7xHyTDJn-EjzpfM5UYB8vxgxA=mo,"Data saya bocor, orang mau bayar pajak dipersulit",1,0,1.3.0,2024-03-04 12:22:20,,,1.3.0
973,735aac31-7727-4520-ae1e-ed8d02466713,Rudolfhuta Barat,https://play-lh.googleusercontent.com/a/ACg8ocJjIl2EBrcZca0Vna2mH6ezJTE5voVBT0hmBAYxqyW3PCfUgNg=mo,Sangat bagus 👍👍👍👍👍👍👍👍,5,0,1.3.0,2024-03-04 11:01:38,,,1.3.0
974,aa65c4c4-c4e0-43df-93ec-8c5e36e80b55,Johan Sefri,https://play-lh.googleusercontent.com/a/ACg8ocJQCRN_pm4QiYPbISmsyQHifgHcLyinNxPNEgvBeDwL8h5zJg=mo,APK ny klo beloem dapat beraktivitas dgn layak.... Tak usah d i pajang di play store....bikin malu pengguna.... memangny duit pajaknya dikemanai ... Buat Apk ny bobrok gituuu,1,0,1.3.0,2024-03-03 21:30:50,,,1.3.0
975,72135687-e1dd-49ec-8912-4307f5d77f20,Dudin Setiawan,https://play-lh.googleusercontent.com/a-/ALV-UjVP1vZ_Vy2fZ_tlm8uX_BcybbPaa7gdvo9NsM-k9Ag--zh6iwL3,Oke Bagus,5,0,1.3.0,2024-03-03 21:16:21,,,1.3.0
976,120f053a-19c6-42a0-8347-dc79ee3ce79a,Fandysa,https://play-lh.googleusercontent.com/a-/ALV-UjXqfqz1eaCDOZ2E_0Ix8QHopPyQLOMGtO1Q18KJDYfw7ZvyPpjl8g,Okhay,5,0,1.3.0,2024-03-03 12:04:09,,,1.3.0
977,465a6d3d-874b-4820-aaa2-0e695fa3cec2,gagal sukses,https://play-lh.googleusercontent.com/a-/ALV-UjVhcpiMnrQVyyr5o7NNbLE-QedjjWBYEckR41aqq6zjDG_IpcqK,Aplikasi sampah .semua aplikasi milik pemerintah itu gak ada yang bagus systemnya amburadul,1,0,1.3.0,2024-03-03 11:52:22,,,1.3.0
978,0f5111b3-a189-4dff-ada7-8d463d7cf586,Iman Rasman,https://play-lh.googleusercontent.com/a-/ALV-UjWjHlVERbyHGPi-GSYb38r5vRQuXy-jMiuIRAdqxScb-BE4hrbn,Kaga bisa lapor SPT padahal kalo bisa lapor SPT mah lumayan bagus nih app,3,0,1.3.0,2024-03-02 23:02:20,,,1.3.0
979,4372f978-d9c0-4ff9-9086-465b6e1ad053,Heri Purwanto,https://play-lh.googleusercontent.com/a-/ALV-UjW1eR2LZsgV14DehpyiWedNTco6OVkDb6dsSyjdPsqImQ-uJg,Tampa ribet dan proses cepat,5,0,,2024-03-02 18:26:48,,,
980,709b795e-5904-4c99-8925-5c766ed38179,Tomy Yuniawan,https://play-lh.googleusercontent.com/a-/ALV-UjV4phRfWvxijBqQYnLM4La_7G6dye45cSrz-4yTMHJkdj0FUB96PQ,Aplikasi gak berguna mending langsung pakai web.aplikasi sampah,1,0,1.3.0,2024-03-02 16:13:38,,,1.3.0
981,8b94b215-0687-4b3c-8551-202a7f4f8750,El Young King,https://play-lh.googleusercontent.com/a-/ALV-UjV5eNkg4RuKdEAL2DXMS71ml0bG8CcnCGQe_VljKdT8D6Lrh-U,"Kode verifikasi berhasil dikirim, dikirim kemana min? Lain kali pake developer yg besar klo mau pesan aplikasi Jan pake orang dekat, busuk hasilnya kek gini, gak ada yg masuk gk bisa pake cara lain",1,26,1.3.0,2024-03-02 13:01:59,,,1.3.0
982,7f56b280-1ddd-48e9-9183-fa12e71ea3c4,Taufikur Rochman,https://play-lh.googleusercontent.com/a-/ALV-UjV8hMkdwYZLIeKHEVidGx3mERW3m6Blf5Ly8CV6DN5sZEydjRY,cacad,1,0,,2024-03-01 19:20:00,,,
983,15612aa7-e168-4549-a2f8-ede90b6889e9,Telor Dadar,https://play-lh.googleusercontent.com/a-/ALV-UjVsGFpClrd4YSmSaQqWX9NuQNrwoEvp-8QTh5JdDt2tSBz87NzC,"Mau lapor SPT aja susah , gak ada menu SPT nya",1,0,,2024-03-01 17:59:37,,,
984,4c7201b2-d510-46ba-b366-dce433bd9598,Yono Supriyono,https://play-lh.googleusercontent.com/a-/ALV-UjVSxYiSCl490Pe3KwejJrCEPx0HbWOHMuOfGG-8HWl_p99TEzp_,"Ngomong nya di permudah, asli nya di persulit...fitur gak ada yang bisa di pake",1,0,1.3.0,2024-03-01 15:23:30,,,1.3.0
985,af4480db-d41c-4a9b-8205-d3b3ca877926,roni channel,https://play-lh.googleusercontent.com/a-/ALV-UjV5vZoda2ysasG9alC9qZn-5y-9nYIaP2Q0bvwLepfEGKtwdqtS,Pergi ke kantor suruh online Nyoba online Captha nya gak masuk masuk padahal udah bener Yang ada ngabisin pulsa doang Tolong dong di permudah ini kan buat pajak buat negara,1,0,1.3.0,2024-03-01 07:57:56,,,1.3.0
986,bce30c47-d922-4769-a817-3bc249617ca3,Yanuarius Seran Nahak,https://play-lh.googleusercontent.com/a-/ALV-UjUimOnbiWqBkB00Bm0KxjVuKzlMI1Y5iPAQbNHtg0X1g9yIsEhb,Memudahkan dalam lapor pajak,5,0,1.3.0,2024-03-01 03:45:10,,,1.3.0
987,77b6e44d-fa2c-4b19-9c49-315f3cc9d60c,dede suhendro,https://play-lh.googleusercontent.com/a/ACg8ocIr2WyMy18LThzLluO_-_TqNi0tj8AGcZoR0JH5fie4Xv0x7Q=mo,ini sebenarnya buat apa aplikasi dibuat??? kok saya merasa g ada faedahnya... berharap ada aplikasi agar dipermudah dalam administrasi nya..eehh malah seperti spam ni aplikasi...mau lapor pajak aja gak tau dimana yang mesti di pilih.. beneran kecewa sama dinas perpajakan yang bangga pakai ni aplikasi secara global,1,15,1.3.0,2024-02-29 20:00:36,,,1.3.0
988,9865d29a-0b3d-4ddb-b10f-417c396080cc,khabib bunnajar,https://play-lh.googleusercontent.com/a/ACg8ocJotOAIgG0A_w4BwfDEE5e3YfXrtNYQ7_Pbgp4JguiXkHkvZQ=mo,Aplikasi tidak berguna lupa efin sudah kirim berkali kali di cek di kotak masuk email nihil efin nya makan gaji buta,1,0,,2024-02-29 17:09:07,,,
989,b3424c67-fe74-4aa8-84e2-808dd6a06f31,Sutikno Boiler,https://play-lh.googleusercontent.com/a/ACg8ocI_WXAG4tEV8OLdIilHTomKugKRaHD4Lh_JlJlxc0CQdqBYJQ=mo,Sangat medukung,5,0,,2024-02-29 17:00:20,,,
990,59d45c3c-a2da-4b70-9f6a-149cf287066c,Afif Hidayat,https://play-lh.googleusercontent.com/a-/ALV-UjUXlBhKWLZfQ-rpp8ZDoTbG-V_VCelnKIuB73HKuhPKHUPI2YYr,"Aplikasi buang2 waktu Log out terus, proses pengecekan efin",1,0,1.3.0,2024-02-29 16:26:13,,,1.3.0
991,6605e3be-da04-4165-a7d5-b56aca101928,Bajuri Mamboo,https://play-lh.googleusercontent.com/a/ACg8ocKUFLy6-yHuFdcz_foIhEaRVxRyWQ7wJJ_u9-zCZsa8lDDavQ=mo,Force close bego,1,0,1.3.0,2024-02-29 13:40:50,,,1.3.0
992,fd1a35f4-cd04-4793-9894-9fd21a84bc93,Taufik Hidayat,https://play-lh.googleusercontent.com/a-/ALV-UjUQDCzUOwwiy1detI8UwrhekazsOpZ-c9ouuhLwo4LShSOcqutc,Ok,5,0,1.3.0,2024-02-29 11:08:06,,,1.3.0
993,a43bc2c6-5e65-4395-8580-0a4d209f78f7,dewi silvia yudistia,https://play-lh.googleusercontent.com/a-/ALV-UjXkAWPewDWZ2ri4yzsxB405GOTOL_nVEbjpZuK6PqGJKTHAwbg,"Aplikasi ini sangat cerdas...🤗🤗 Terbantu sekali,,saya sudah lupa dengan efin saya dan mertua tinggal isi data dan foto diri..langsung dapat efinnya..terima kasih m-pajak 🙏🙏 Mudah²n dapat lebih ditingkatkan lagi, dapat digunakan utk segala keperluan perpajakan spt pelaporan dan pembayaran pajak..",5,16,1.3.0,2024-02-29 10:39:21,,,1.3.0
994,a8aa9531-73ec-45f9-a39f-bd9a2d771db6,Ingat Mati,https://play-lh.googleusercontent.com/a-/ALV-UjWeuHpGb9sQ0uaM1RuObUGqhkZ1pEj6bGkQNrrhrsHF9MjCsaI,"Ribet, lama, nyusahin, dicoba berkali kali minta kode efin kgak bisa2",1,0,1.3.0,2024-02-29 09:07:40,,,1.3.0
995,89557d02-565a-4e2f-afe2-dc31af34beaf,Bangau Frangki,https://play-lh.googleusercontent.com/a-/ALV-UjUBDDfkzDUiDxh-DO5it_YQ27Hw9Q2FORuxC_jxJE2La7f2N-c,Aplikasinya Bagus banget keren 👍👍👍,5,0,1.2.5,2024-02-29 08:43:11,,,1.2.5
996,93d3a38a-2a19-49f4-a170-792400b3a00f,Ilham Bijon,https://play-lh.googleusercontent.com/a-/ALV-UjW_lHjz4MobRibwPVp-IzE-V34lTA7wVZoZnkhVM50RNTg2nv0,"Ribet banget mau login susah, dipersulit harus masukan kode EFIN minta verifikasi kode EFIN gagal terus. Padahal gue bayar pajak tolong jangan dibikin ribet atau dipersulit gimana orang yang lupa password dan kode EFIN?",1,0,1.3.0,2024-02-29 07:54:55,,,1.3.0
997,eea5fa18-4a94-4499-963c-5534b7b72963,Lasmertoni Silalahi,https://play-lh.googleusercontent.com/a-/ALV-UjVpjsKc97vjUi3OnU5gEJbsjQwY0msGb20V9VhsRbihtukowony,"Kalau belum siap servernya jangan paksa pakai aplikasi ini, Semuanya coba lihat gak ada yang puas.Mau setor laporan pajak sendiri saja ribet sekali.",1,0,1.3.0,2024-02-29 01:37:17,,,1.3.0
998,9eb41e9a-3e35-4203-be49-0c1746194092,SkyNight -,https://play-lh.googleusercontent.com/a-/ALV-UjV5ts9qjUR-SXBkjdsEpTpGdOtlKBKuhkpZMrQnbgW-3OOyUnyE,"eehhhh co gw mo bayar pajak susah amat co,, klo develop app yg serius napa , bukanya di permudah mlah di persulit,, heran gw mau taat pajak ajj susah",1,0,1.3.0,2024-02-28 17:06:13,,,1.3.0
999,2fb4ad8a-14cf-4776-a864-718695a880d2,Teddy juanda,https://play-lh.googleusercontent.com/a-/ALV-UjWS6csjAIIOKr-vGas5-8CWswd5UvRqChLg6k2utYdNphyX0bs,halo m-pajak ada terdapat bug di aplikasinya ketika lupa efin dari sistem sudah muncul pop up berhasil dan kirim email tapi saya cek emailnya belum ada email yg masuk harap segera di perbaiki,1,9,1.3.0,2024-02-28 12:34:56,,,1.3.0
1000,4ffb2d1a-bc9c-4a51-a965-60c7447239bf,Sri Ratnawati,https://play-lh.googleusercontent.com/a/ACg8ocLj1WkbNqeNIO9TmdLiBnCL_lkpNAk3YzDqxyNh7-asf5gukQ=mo,Serius nanya ini fungsinya buat apa. Mau lapor spt aja ribet.,1,0,,2024-02-28 11:08:19,,,
1001,434bb827-1c82-4588-98ef-251e7a6c9ace,Moch Fauzi,https://play-lh.googleusercontent.com/a-/ALV-UjXSeYakgB84gxwcO3APBvLn3BXIYEgGClwHFiSO4fwlMYDRJI-Q,Aplikasi sampah sampah,1,0,1.3.0,2024-02-28 10:38:10,,,1.3.0
1002,d90dfb37-279d-4b53-a6cc-3a040ff264a9,Deriel 93,https://play-lh.googleusercontent.com/a-/ALV-UjVXM3uZoJgArAUHFHeNvEA7qAHIn4xpAkdgvlB-IoqhX5riAq5T,Parah kode otp nya mana ko gak masuk'' klw aplikasi milik negara kaya gini sulit untuk di gunakan bhkan bnyak eror,1,0,1.3.0,2024-02-28 10:18:08,,,1.3.0
1003,4bd06d3b-12a9-4963-a1f0-a54fb78ebe30,Harto Megapower,https://play-lh.googleusercontent.com/a-/ALV-UjXQq9ei9HuPpY6uTew7WLX-Uqhxbq2miztJ6oP4pQ4ZXURFy0sF,Sangat ramah layanan nya,5,0,1.3.0,2024-02-28 08:56:34,,,1.3.0
1004,3d556b6a-6fc3-4d65-9957-fb87e8d41a5c,tori haryanto,https://play-lh.googleusercontent.com/a-/ALV-UjXxmdR-YaFCQGOXXTGJNaJ4LQEwTFiSjE6EhcgxdTOKkqy8WwSq,Kode otp ga kekirim² padahl udh nunggu lama,1,0,1.3.0,2024-02-28 04:17:34,,,1.3.0
1005,e7630262-4c9f-4e5b-82f2-7f7ba75c2a5e,Agnes Gustyani,https://play-lh.googleusercontent.com/a-/ALV-UjWAeeW21OMDODTjXZGc41wvR0hLj5pTSvJ56-XroAakdIQ-vo2DSA,aplikasi ga guna,1,0,1.3.0,2024-02-27 22:55:07,,,1.3.0
1006,cf94d8ce-5990-4c26-a188-6154fb8796bc,Nuraeni alfiah Damayanti,https://play-lh.googleusercontent.com/a-/ALV-UjVx3JwLHtQv0HVoNk1Di2n8iWzdlFAI6nwIl1C7832uggk7pvA,Apk ga jelas error mulu,1,0,1.3.0,2024-02-27 18:44:13,,,1.3.0
1007,f34c03cc-cd24-4444-bdf4-6ad98721363e,Warung Echa Aesh03,https://play-lh.googleusercontent.com/a-/ALV-UjUNCtwjncJzPp2vjRiPX61rtU4Kw7ZUQjYDoG5PTIgk1nN5UcD8HQ,"Ini aplikasi belum epektif apa gmn ya,kok sy tinggl upload foto ja susahnya minta ampun,mungkin dah berpuluh puluh x ni sy coba error terus,,gimana ini???🤦🏿🤔",1,7,1.3.0,2024-02-27 17:18:54,,,1.3.0
1008,0b230986-6305-4bb6-8d81-a1fa4c349f42,Gunawan,https://play-lh.googleusercontent.com/a/ACg8ocJuuDO8WcgTxPlY8pGmITRAgm-ama8cMVL9YUq8UjdetXD12g=mo,Payah...setiap daftar mandek terus di kolom pilih pertanyaan..ngulang lagi dari awal..sdh puluhan x dicoba...mau jd warga yg baikaja msh sulit...hari kerja sy gk bisa datang...tolonglah dipermudah aplikasinya..bener bener oayah..nunggu verifikasi lamanya bkn main....pemkot bagaimana ini...bikin aplikasi bknnya mempermudah malah bikin senewen tolong yg bikin aplikasi di cek lagi aplikasinya ...sy daftar entah yg ke brp puluh kalinya..msh mandek di pilih pertanyaan...gimana si adminya,1,46,1.3.0,2024-02-27 16:05:19,,,1.3.0
1009,86b4e7bf-0f38-4565-8256-d3748e26d14a,lutfi dwi,https://play-lh.googleusercontent.com/a/ACg8ocKjD_-nq8X5TI_ZTGanFVKIUvyFB1tPFOvZ4MwxSd5UgKfqTQ=mo,"Lupa efin, pengiriman kode Verifikasi melalui SMS tidak masuk"" Ditunggu samapai 1jam -2 hari gaada SMS masuk, melalui email juga sama tidak bisa jawaban malah diarahkan untuk menghubungi nomor kantor pajak sudah dihubungi tidak bisa, lewat live chat disarankan sama seperti saran di email, Tolong jangan seperti itu customer sudah mengikuti arahan yang diberikan berikan kesan yang baik!!!",1,15,1.3.0,2024-02-27 15:42:56,,,1.3.0
1010,49b4e011-2487-4306-bb57-07d5a0786d8d,Anzas hardiana,https://play-lh.googleusercontent.com/a-/ALV-UjWWKF9N4IzbhOu9BxyHTrWfetzfeYaegsoFLpUk1oB_Bhp95P3q,hari gini minta efin suruh datang langsung ke kpp nya..ketinggalan zaman bos..gmn mau maju perpajakan negri ini..sulit,1,0,1.3.0,2024-02-27 14:43:12,,,1.3.0
1011,94f69582-0e93-4a85-8cbd-61d78c3e36c2,Teguh Kusumajaya,https://play-lh.googleusercontent.com/a-/ALV-UjUXOdrJ-J1tHbRgythUyKZ4E6wa2q17_cT4S-j6YS4O78HMGLcR,"Pengalaman CS nya jelek banget sihh. Komplain tanya mengenai Efin belum selesai malah langsung di putus, leave chat admin nya.",1,0,1.3.0,2024-02-27 14:33:22,,,1.3.0
1012,3293d69b-b767-40e1-8620-f0de9bf0a3a2,m1 adak,https://play-lh.googleusercontent.com/a-/ALV-UjXfJ-apESU5bMKCkQHTPHMPFwElhzP00qCh3zQhzNTbmn8WsS_K,Jangan mbodoi rakyat otp ngak gratis capcay ngak pernah di lolosin kenapa pasang aplikasi klu di persulit suka knibal teman makan teman,1,0,1.3.0,2024-02-27 14:10:50,,,1.3.0
1013,4bbe7bfe-de05-420e-9208-fe9ef20231c0,Muhammad Ikhsan Ramadhan,https://play-lh.googleusercontent.com/a-/ALV-UjX2uv0BluX6DnVwZcKyTEQ3kraQB5_JeL18fb1mTzYIGRmJr6ne,Aplikasi gajelas,1,0,1.3.0,2024-02-27 13:53:44,,,1.3.0
1014,53d29981-6c74-4753-8699-a9dea305eb24,Zepri Yanto,https://play-lh.googleusercontent.com/a-/ALV-UjV4cF76ngU7moupBz_z6M0AdlFdeU7n4hibNfM8EZkbbXQjY_U,coba dulu,3,0,1.3.0,2024-02-27 08:42:19,,,1.3.0
1015,ca3c0079-ee41-4c40-adfd-1450c20b34dc,Agnesia Sinaga,https://play-lh.googleusercontent.com/a/ACg8ocIqvHGItBDHhRIPpy4MW_Uf8X8p_e7BT-qcATEgaHzJeM6c3A=mo,Eror,2,0,1.3.0,2024-02-26 13:42:13,,,1.3.0
1016,19018c3c-4148-4f5d-bf15-4afbcbcfa3e3,Idris Harahap,https://play-lh.googleusercontent.com/a-/ALV-UjX4-1gJoeJ3I6Djh4j_msW0MVLFMC-ojJgiSJdnUn6Gp5V-aph-,"Aplikasi gak jelas, ngapai lu buat aplikasi klok ujung2nya untuk sebuah nomor Efin aja lu suruh org ke kantor pajak!",1,0,1.3.0,2024-02-26 10:23:45,,,1.3.0
1017,7ecc0317-149e-4767-a56e-d29f54a6cd4e,edi zulfahmi,https://play-lh.googleusercontent.com/a-/ALV-UjUYJypEWiN-n2a_US600cmbuTOtN2S28lsFTYc5NflG1sB-88Q,Untuk pelaporan pajak nya tidak tersedia. Untuk segera di benahi,3,0,1.3.0,2024-02-25 20:42:46,,,1.3.0
1018,d3ce7720-89ac-49de-ac3f-76e65e3ae3d7,dhaesthi ajeng,https://play-lh.googleusercontent.com/a-/ALV-UjUhalZxylPnuZBe8FrvfNlTOq7SD5teSXyvAfLtAvBoOCt545Fb,"Bayar pajak lancar, aplikasinya kek kont*l",1,0,,2024-02-25 16:18:39,,,
1019,7acac2cf-3e8f-4c54-ab16-02588e9f37ca,Johan Triwiatmojo,https://play-lh.googleusercontent.com/a/ACg8ocKE_tW_YGk3cAWItDMfKQo7oPGkDGLhX4NfkmweDCkKT52cgA=mo,"Hahaha, daftar onlen di browser ngestuck di validasi Nik+KK, Giliran download app nya gw kira bisa daftar, eh malah butuh NPWP yg udah aktif, KOCAK WEB DEVELOPER-APP DEV NYA. BANYAK LULUSAN IT NOH SUSAH NYARI KERJA, EH INI BUAT HTML-PENDAFTARAN ONLINE AJA GABISA. era digital tapi sama aja boong, harus dateng juga ke pusatnya buat daftar NPWP...",1,26,1.3.0,2024-02-25 13:23:40,,,1.3.0
1020,f8d57998-4ac3-483b-ba9f-850cf5b36dec,Info Ngopi,https://play-lh.googleusercontent.com/a-/ALV-UjWfE5faTqyo3mVQP2cFw09tPEkIIKBYSgX5sFWUC_7lMiXTFOw,"Apk yg sangat bagus. Tidak ada bug,delay & iklan. Keren sekali!",1,0,,2024-02-25 12:59:50,,,
1021,922b3661-e611-4399-b221-a91aa709ed57,Abina Aqa99,https://play-lh.googleusercontent.com/a-/ALV-UjUxLYn68RyHiLd9pUOSCzZSGPlfsR7STzf4iV-63HXy9tjfGQgo,Ga bisa buat lapor pajak.,1,0,1.3.0,2024-02-25 10:09:21,,,1.3.0
1022,72585d56-a56e-4f7f-ad04-6387b2c1ad55,Resa Febrian7,https://play-lh.googleusercontent.com/a-/ALV-UjWZl1AYPehHL1w-0LvoLggKY0oXmKz1AobTq61uKzGor4N8uT8,"Kok bisa""nya gabisa pakai kartu tri.. Ini pajak negara loh.. Harusnya bisa nerima provider mana pun.. Sumpah aneh negara ini, cm masalah sepele aja ga bisa nyelesaiin..",1,0,1.3.0,2024-02-25 07:49:33,,,1.3.0
1023,6eb633ad-4e75-4628-89de-c895fc1c6657,Nanang Yuliandi,https://play-lh.googleusercontent.com/a-/ALV-UjUDsVYlBr5FjynO_q6vQspphykeO_rPRl5Cj-M6tJdId3jZfqIM,"Aplikasi yang tidak bermutu, semua serba error, mau verifikasi lupa efin sudah berapa hari dicoba masih selalu gagal, tidak ada efin gimana mau login? mau live chat dengan CS pun selalu gagal tidak bisa terhubung. Semua tidak ada yg bisa digunakan",1,66,1.3.0,2024-02-25 07:29:19,,,1.3.0
1024,80af5863-6b79-4ff6-8ba6-fab3285b0d72,Gama Eriawan,https://play-lh.googleusercontent.com/a/ACg8ocLK1XcY006dujyqbthf-5U6RHcA48eVzwyCNEYdBX1sqZPJlg=mo,Completely the Patient One,5,0,1.3.0,2024-02-25 00:28:17,,,1.3.0
1025,3e31ea29-e795-4314-a692-813c37c6b3b6,zuki suki,https://play-lh.googleusercontent.com/a-/ALV-UjV3k6oBnHMvm3GHY2PC2KG1DsEuW1w2T5zJJuqT1MEH1RHQkgg,Tidak ada menu buat lapor spt,1,0,,2024-02-24 11:46:42,,,
1026,2712c126-63a3-4a43-905b-d923973824db,Andre Zavelin,https://play-lh.googleusercontent.com/a-/ALV-UjV6IVPralWj_ItGi9aQo741dJ1UP1tZNBA5ZVQufyYPoUd3m5wk,Katanya kode efin sudah dikirim ke email tp pas di cek kok gk ada,1,0,1.3.0,2024-02-24 11:09:50,,,1.3.0
1027,22f6f118-6e46-4990-a4b0-533c8456d9cd,Herry Dapo,https://play-lh.googleusercontent.com/a-/ALV-UjXz3WZUQGTWotgbM7L8wWsiAN3_Ubp_wznJT2Eu-5m_tZOMSXg,Ok,5,0,1.3.0,2024-02-24 10:29:35,,,1.3.0
1028,07ada83d-6aa2-427f-ab2b-3724e3ff9676,Wahyu Oktaviani,https://play-lh.googleusercontent.com/a-/ALV-UjUY6uCqiiewenzbFnSVRjulUqClh-SG-vFWdXqD52LnGyubQ6tp,Ada layanan live chat yg disediakan waktu 5 detik untuk mengetik tpi isian mengetik tidak bisa di klik. Sangat tidak berguna aplikasinya,1,0,,2024-02-24 06:40:35,,,
1029,ed480e38-df68-4c88-8a3e-02e1c7ca7069,Muhsin,https://play-lh.googleusercontent.com/a-/ALV-UjW7z3wJ_X2YZMfJ-5XH81lepDmNMhWfaUcIVSpVIy8xd1_MLOaq,Sangat bermampaat,5,0,,2024-02-24 05:50:49,,,
1030,cc52705f-43c5-4dfe-97ed-1ea270824337,Abiliodsd Dsd,https://play-lh.googleusercontent.com/a/ACg8ocKSlSYAppzf5Nu6uTBMPsdRTgzmfp0sNsWmsDmscvX7dTPzwA=mo,Sudah bagus hanya saya mau cek nmr NPWP saya,4,0,1.3.0,2024-02-24 00:19:58,,,1.3.0
1031,0bdc50c2-2a01-410a-9728-3aaed9355517,Rommy Geullherme Lumi,https://play-lh.googleusercontent.com/a-/ALV-UjXPSzrrmj1hXwrr84kVMDx7sPHaDgDwF_We4fgyECWmAD1nfmLC4Q,Mantap,5,0,1.3.0,2024-02-23 18:47:05,,,1.3.0
1032,5671c36e-4854-4a3c-8dca-6a050fcc2158,Agus Taufik Nugroho,https://play-lh.googleusercontent.com/a-/ALV-UjXYhqcw9VQvB7UZK_4aJf-eruIKYycsqr1Q-5UDSe2BEfjJbrkJ,aplikasi kek taiii masih aja dilolosin,1,0,1.3.0,2024-02-23 16:59:35,,,1.3.0
1033,745b2a22-11f8-48b3-a4a4-c15aee2639e6,Zaenal Abidin,https://play-lh.googleusercontent.com/a-/ALV-UjXgaWmq1G7MKKZg2w7KqHiMPZ4HNnr_F7VgcO6gKpnZenQrD1LM,Terimakasih.... 🙏🙏🙏🙏🙏🙏🙏🙏🙏🙏🙏,5,0,1.3.0,2024-02-23 16:22:11,,,1.3.0
1034,0aa178e1-da5e-465f-aa5c-b228fb48ec77,Andry Roo,https://play-lh.googleusercontent.com/a-/ALV-UjVH3O_732PhQO1o0u7Xj5_zDcb_VBc05nL2D2H1f_1du5n0fo4U,"Live Chat dengan petugas gak nyambung2, buang2 waktu menunggu tidak ada kejelasan",1,0,1.3.0,2024-02-23 13:56:36,,,1.3.0
1035,cc5daa34-6c3a-4463-833a-6155366d280c,Cari Aman Official,https://play-lh.googleusercontent.com/a-/ALV-UjX_SftAlsMbM1s9JM38yKVbftAa6MZsZjgDduFv4OosaTAR1u8v,Ga berguna ini aplikasi.sudah jelas2 nik atau no npwp benar dan sandi juga benar.tetap aja ga bisa masuk.aplikasi BUSUK,1,1,,2024-02-23 12:53:38,,,
1036,c92ae092-37bb-4f25-b2fc-24c14b8a62d1,Irman Syah,https://play-lh.googleusercontent.com/a-/ALV-UjWVHxrXdXnFzTMBHA4r8mFa10Zaye2YiNtROI9VdJVSpGApRT3A,Parah...aplikasi busuk ga bisa di buka buat download beberapa kali ttp aja begitu,1,0,1.3.0,2024-02-23 10:11:37,,,1.3.0
1037,68a80646-e0bc-40de-95f4-e6c31c5bc4b9,initial D,https://play-lh.googleusercontent.com/a-/ALV-UjVqk2jzpyAxxjfRpJuwh-SEGFzxE5mDEKHDqcHW_GjL1lADyZQ,masih bagus dan mudah digunakan aplikasi DJP yg lama,1,0,1.3.0,2024-02-23 09:21:00,,,1.3.0
1038,6fbbfef2-d64f-4158-b621-bc6205548387,Handoko,https://play-lh.googleusercontent.com/a-/ALV-UjWLBBGIh90if9ZjoOUUzqfSrINcfSK7yY0GmFj-HJ1od4rsgou3,Bagus aplikasinya memudahkan WP memantau Status dan pelaporan yg sudah/belum. Maaf masih belajar perlu tutor nih,5,0,1.3.0,2024-02-23 07:44:57,,,1.3.0
