,reviewId,userName,userImage,content,score,thumbsUpCount,reviewCreatedVersion,at,replyContent,repliedAt,appVersion
1510,2f168f8d-9051-4724-ac1c-df305698b1d0,Iksan Iksan,https://play-lh.googleusercontent.com/a/ACg8ocLE7s-ShNao-ltxCzPJArFSNOvsNujnHwEm_a_ON2BEvbWVLQ=mo,"benerin lagi dl aplikasinya eror""eror mulu",1,0,1.2.4,2023-12-12 08:09:44,,,1.2.4
1511,6e3d2669-7797-41f4-9e66-bbe9cd0f4178,abdul mujib,https://play-lh.googleusercontent.com/a/ACg8ocIFu9Fy3fJe7R-_QHgwPI8eivQ778D5jHRUtUjSWKAigAGgb0c=mo,parah verif efin gagal mulu salah mulu padahal udah sesuai ktp percuma,1,0,1.2.4,2023-12-11 22:12:24,,,1.2.4
1512,0dc366c0-09f4-42e9-ba36-d9c1b79a5cf9,Hendri Febri,https://play-lh.googleusercontent.com/a-/ALV-UjUTUDHtIL8uWU8JWfzSJFyFW7cuIDP6qSMWieKdRhU5N43Ugj8Q,Aplikasi miskin menu,1,0,,2023-12-11 20:40:47,,,
1513,5b9f03c5-86b7-4fbb-811e-ae4e0f6857e4,yuliaa utami_94,https://play-lh.googleusercontent.com/a-/ALV-UjXtpUO0EqMmhzi1cssMiGI10DKg0thaxXNVj4t_Jn5Xk_9FHV0,Lemot gilak,1,0,1.2.4,2023-12-11 20:37:47,,,1.2.4
1514,81a09c79-a920-44ee-afd6-4f127cfcf1dc,Taryono Ono,https://play-lh.googleusercontent.com/a-/ALV-UjVV_n5BeYctKHH-nsvTfUvXb9yPUECNoObIRupFBIvxlibGcKzY,Ini aplikasi gimana sih ..kode verifikasi lewat SMS GK sampai sampai,2,0,1.2.4,2023-12-11 19:39:08,,,1.2.4
1515,a928e9a3-b433-4ea0-8b06-42e344c5d7ce,IR135,https://play-lh.googleusercontent.com/a/ACg8ocIblM-BCwgmAG5o3kdqmPYkHa5BcO0lrrnyhAndRaeSwXRZcw=mo,Ribet banget sumpah nyusahin orang.,1,0,1.2.4,2023-12-11 17:40:29,,,1.2.4
1516,544ffb09-5b49-4d85-aa3f-db9f779e5696,Umy Amalia,https://play-lh.googleusercontent.com/a/ACg8ocJIVkpy-yWJJIkZtBOfqXbAFhrxGj_eg2vmN46Eh0V6h6Nc3A=mo,Tidak membantu sama sekali. Hapus aja,1,0,1.2.4,2023-12-11 17:33:09,,,1.2.4
1517,97f96f15-07db-4232-832c-41570ea1388f,Asep Pratama,https://play-lh.googleusercontent.com/a-/ALV-UjUpVhJ-PifStWSd_lva_i4stQL_T7f28LUll8DJngnxqNOR9YyP,"Lupa E-FIN dan sudah masukkan data dengan benar tapi pas submit data ada notif error ""verifikasi gagal"" tidak bisa mengirim data. Kapan diperbaiki aplikasinya??",1,24,1.2.4,2023-12-11 17:22:06,,,1.2.4
1518,7314df0e-8732-4a33-a4f1-3b202b7930ae,Aksan Art,https://play-lh.googleusercontent.com/a-/ALV-UjWQ9x5FYdarGTYM2JamUpZI9RZW1yvAq2nPtWFnNU1JD_5mkbk,"Error validate ktp, maunya apa",1,0,1.2.4,2023-12-11 15:52:55,,,1.2.4
1519,01765533-e22a-4e89-8cd9-2561e64c8342,Mocca Mocca,https://play-lh.googleusercontent.com/a-/ALV-UjXNDSMi-ExY7V-BE01yNjj1BASR1fslhx3N6sSajwLJHMf966hR,"Yakali pak, id udah bener, pasword udh bener. Masih aja gk bisa masuk karena salah pasword.",1,0,,2023-12-11 14:05:41,,,
1520,f1b1d9fe-a373-41ef-8650-c68b6a311301,Dian Ardiana,https://play-lh.googleusercontent.com/a/ACg8ocJOfdnFcEjEv4EaMMMFZ04_9w95nXisef4z0bEgwFrY82uGIg=mo,Sangat bermanfaat,5,0,1.2.4,2023-12-11 09:50:35,,,1.2.4
1521,9f07e7a0-a9bf-48ff-8b1a-aad0e0ee33d9,no-reply,https://play-lh.googleusercontent.com/a-/ALV-UjWNLSz-dvzplnZ6K_THAAr5uMyVKotaSSiRlLxliVRl3ffLI3w,gk heran klo app yg dikelola pemerintah,1,0,,2023-12-11 08:39:59,,,
1522,fe09b2ad-d4b8-4637-ae41-1820c7441be1,Jul Masaihang,https://play-lh.googleusercontent.com/a/ACg8ocLopWaeoXvRWm9g33pvsyd0ZtZnjJ7EaNc0BrRXt7Dpu29U7A=mo,"ribet sekali hanya untuk daftar npwp. Pergi ke dinas setempat disuruh daftar lewat app, sungguh membingungkan.",2,0,1.2.4,2023-12-11 07:16:46,,,1.2.4
1523,e34afa41-684b-4448-b74c-94e8de1dab72,Riski Junaedi,https://play-lh.googleusercontent.com/a/ACg8ocIYTbHDEr1KydVbnXmDFTgoh_0oj3BokoJOXdOiuss1pKwI0w=mo,Aplikasi ga jelas minta efin ajh susah bnget .. pdhal data bner foto selfi jga bner smbil bawa ktp npwp .. perbaiki lah,1,0,1.2.4,2023-12-11 06:12:58,,,1.2.4
1524,afc561d0-d790-4ef8-ba8a-fe1295df6ae6,Kurenai Maria,https://play-lh.googleusercontent.com/a-/ALV-UjUPCQqewdP5Py-wRSNkMlHRNf-dtki6TQ6tXfiECeI0tvuZSXzF,"yailah untuk daftar aja sulit stengah gila,masih ala2 online.jelas dri dlu klw pke online slalu bermslah dan gk berkembang alias nyaman dngan lemotnya sistem yg tdk di perbaharui. please lah klw mau pke sistim online2 perbaiki sistem nya,masa bgini mau dibilng maju.kapan..?",2,0,,2023-12-11 00:46:01,,,
1525,b61462ce-d1ee-4667-afed-742f4e5a15bf,M Sofi Latif,https://play-lh.googleusercontent.com/a-/ALV-UjUZGfttGWGQkLtBVbyo5X4os0E_SN8h4DelmogjrxbPpTmbg0AB,"""Tombol"" Buat kode billing ndak aktif terus... 🤦 tolooong!!!!",2,0,1.2.4,2023-12-10 22:17:45,,,1.2.4
1526,a19d9e14-c594-4da7-84eb-27d7b4ead35c,APRIX CHANEL,https://play-lh.googleusercontent.com/a-/ALV-UjW-oPbNPJeAESJlaq2g4tfTsSJmLAW23pbYpYPogf46OcTYcTZl,"Wah aneh nih aplikasi,, mau login pakai NIK eh malah digitnya nggak cukup, pakai NPWP juga kagak bisa masuk,, 👎👎👎",1,0,,2023-12-10 18:47:12,,,
1527,192bc87b-5625-4163-8914-01bcbd03573e,Baay Kuylah,https://play-lh.googleusercontent.com/a-/ALV-UjUr9yJa0tZOIjggPfYQmAjs3h2g9_5eVQ57y6KlKGYwSeTyr1ai,Mohon arahan min...sy setelah mengisi kolom lupa efin..setelah mau verifikasi kodenya kok terkirim ke nomer sy yg lama tidak aktip..bagaimana cara merubah nomer hp untuk mendapatkan kode verifikasi ke nomer yg skrg masih terpakai,5,0,1.2.4,2023-12-10 10:39:52,,,1.2.4
1528,6742f40a-1ae5-4080-a577-8cbbfefb3f8c,Raditya Ananda Putra,https://play-lh.googleusercontent.com/a/ACg8ocJFjcur9Yr3cH9A6rNrAdLm0hisQLFDK4x5G0XsMOLMSdbxCw=mo,rusak aplikasinya,1,0,1.2.4,2023-12-10 09:13:59,,,1.2.4
1529,eaee5dfb-cb10-4a3e-bc7e-56ebe752ef70,pemula gamer,https://play-lh.googleusercontent.com/a-/ALV-UjVbfWrC-tBRM3ry5FNfpZfvCKzq8pmvEc6CxF5mOgtsqbMrH3Tr,"gak bisa login pakai NIK, pas input cuma bisa 15 karakter sedangkan NIK mempunyai 16 karakter",1,0,1.2.4,2023-12-09 21:22:12,,,1.2.4
1530,a944922a-c102-4973-b46f-b3469c24eca6,Edi Yansen,https://play-lh.googleusercontent.com/a-/ALV-UjV80vlLonQJr0l1o4NWDXUQC76r4Hetjol-Cel4efciVW2oDsc,"aplikasi kentut, lelet dan banyak iklan",1,1,1.2.4,2023-12-09 16:58:59,,,1.2.4
1531,92e87bbc-0e40-4216-8759-66590a7bec40,Tenyoumz,https://play-lh.googleusercontent.com/a/ACg8ocIQKNEW_mwlMhHYZfYLbcN5UyDixVMxZdM4AZelbUb968bE2A=mo,"Aplikasi maupun web pemerintah selalu saja jelek, lemot, ribet, beda dengan milik swasta sat set sat set tambah mau menyampaikan kritik namun webnya tidak bisa disubmit.",1,116,1.2.4,2023-12-09 15:22:30,,,1.2.4
1532,da3abd05-785f-44b6-88f4-221ae0835f6f,Rijali,https://play-lh.googleusercontent.com/a/ACg8ocLahJ1mtIM3gIX7NKV3_VIhv6yY1kSi1XO_JkGnADTyxvPiMTQ=mo,"Login di persulit,, sandi di masukan sudah benar,, tapi tetap salah dari sistem,, sangat mengecewakan",1,3,1.2.4,2023-12-09 11:52:47,,,1.2.4
1533,f829841d-3b49-42b4-a6ab-407879caa043,Muhamad Izzul Wahid,https://play-lh.googleusercontent.com/a-/ALV-UjXyh_5fmN9CKT6ZuHur41-egGQer1cPmw5kV2mEjOu_bpDW09U,Aplikasi asu,1,0,,2023-12-09 11:43:02,,,
1534,2c7080f6-5ac2-420b-ac9a-682608660fb9,Ifin Susilowati,https://play-lh.googleusercontent.com/a/ACg8ocK1a5E-KX3I4I4aFGM3-dPNQHJjMNIFCFpjuYmAmWXz_YVGfQ=mo,bolak balik mengisi data lupa kata sandi katanya suruh cek email tapi ttp tidak bisa masuk.. aplikasi parah banget tidak bisa membantu memperlancar.. membingungkan.,3,6,1.2.4,2023-12-09 10:41:28,,,1.2.4
1535,6623d5e2-50db-4d54-958c-dbf83a9649fc,Bimo Ad Photograph,https://play-lh.googleusercontent.com/a-/ALV-UjULHV2bjJ8bIekGupVajnTf09iv5hCrDYjLKMfFGO41-gybT1hU,"Tidak Jelas, melakukan pengajuan lupa Efin selalu gagal verif padahal semua data sudah sesuai dicoba berkali-kali tetap eror terus.",1,0,,2023-12-09 09:44:14,,,
1536,8f7926f0-44c0-438a-9026-9c674dca821c,Andri Gotawa,https://play-lh.googleusercontent.com/a-/ALV-UjVsiGpgDKksWm_kAKSDf9pch3idgPOE3zCUJggm-53fXtc-all5,"log in berkali2 gk bisa,sudah melakukan validasi data log in pakai NIK tak bisa",1,1,1.2.4,2023-12-09 09:11:51,,,1.2.4
1537,b3a77d4f-4f98-4f5b-8d01-97fa07f339ab,yaudah iya,https://play-lh.googleusercontent.com/a-/ALV-UjXWEPRYnmQPGMaUBGb2btqKc4cP4lEnbRYD7LPFCltTzwbJtr40,"Banyak bug, terlihat app ini dipaksakan dibuat, lucunya app ini adalah app yg mengelola uang kolektif seluruh masyarakat untuk pemasukan negara tapi bikin dan ngurus app segini aja kaga beres, kalah sama app pinjol yg meresahkan😂😂",5,3,1.2.4,2023-12-08 23:36:28,,,1.2.4
1538,b488e93e-016f-4899-9308-9b65d55a858b,Ahmad Shodiqin,https://play-lh.googleusercontent.com/a/ACg8ocJy-xVwNe6iZR1TPdo7Ea7GnmKsJ7Sd69QH0hA4VKIyEPIR=mo,Aplikasi taaaaeeekkkkkkkk...... udah itu aja...,1,0,1.2.4,2023-12-08 15:21:07,,,1.2.4
1539,c3f64706-9306-45d0-9f9b-0849093d38ac,LMITV,https://play-lh.googleusercontent.com/a/ACg8ocKisc0zDw1-gAppDGMBBPwi-ma-TdhgH66m1-sShlPgvCz_9KA=mo,"Mau foto Selfi utk klaim efin aja sering keluar sendiri, wa admin cabang Kuningan Jaksel Mala cmn di baca , itu karyawan makan gaji buta njing",1,0,,2023-12-08 13:50:42,,,
1540,1c9f80ad-5413-4142-b134-783c8b8573d4,panjoel junior,https://play-lh.googleusercontent.com/a-/ALV-UjXGZwaicoeiyUt7m29R94DkXyiRsvpIRPeOApHGxINzkDRWPg4p,Sdh Di download malah ga bisa masuk,1,0,1.2.4,2023-12-08 12:35:25,,,1.2.4
1541,e19c15ac-5523-4bff-ac59-3fea1b065333,Ayu Lestari,https://play-lh.googleusercontent.com/a/ACg8ocLfZ6tKMZcQGM4K5PcNEC4nzsMYuv8RGi8oGonAaQMBSNZkMQ=mo,"Haduuuhhh mau bikin NPWP aja susahnya minta ampun, tahap 1&2 nya sudah beres giliran isi formulir tingkat 2 nya yg data pribadi itu susah bgt dari smlm sampe skrg ga bisa terus pas verifikasi data padahal data kenceng.",1,7,1.2.4,2023-12-08 12:10:38,,,1.2.4
1542,477bdad0-dcd5-4855-8cd5-80032fcb5f2f,Shuffle Channel,https://play-lh.googleusercontent.com/a-/ALV-UjWsLk7V1fF14VL5EriiGstlPNBsfVpJTO7aJu_c2eC2wOmfA7Y,"maaf, karena ada pemadanan sekarang login bisa pakai nik, tapi di aplikasi ini max char length di NIK/NPWP hanya 15. jadi untuk login ke djp pakai app ini belum bisa pakai nik. tolong tambahkan max char nya",2,0,1.2.4,2023-12-08 10:29:44,,,1.2.4
1543,8c7d3d63-7b63-412a-b3d2-d53583aaf42d,Taufan Tri Nugraha,https://play-lh.googleusercontent.com/a/ACg8ocJuQkrAZKBvwhjGvfCdbIm518xriOdhl7c10XMDqtH3T3gSYPA=mo,Sdh di isi sesuai permintaan tetap salah terus,1,0,1.2.4,2023-12-08 07:58:27,,,1.2.4
1544,71c3c106-5745-4f26-a8a0-9c429349104f,Oksi A,https://play-lh.googleusercontent.com/a-/ALV-UjVhWBihEnLL9VDR-7xwHmzJvN807QRRR1SdM4EzkdULhkUAVYI,Aplikasi ini bikin jengkel orang aja NPWP / NIK dan Pw udah bener ... eh ... katanya salah Jadinya kan bikin kesel orang,1,0,,2023-12-08 06:22:56,,,
1545,a27554bd-68da-499d-aca7-d41711728201,Rangga Nugraha,https://play-lh.googleusercontent.com/a-/ALV-UjURW1knTn-eDz-15B0RVp0PP4VO5VlY2Jyc-tfMx7xChAul-0gZ,"Jumlah input karakter nik untuk login kurang 1 , sehingga nik yg diinput/diketik tidak akan komplit bagaimanapun caranya. Ini entah disengaja biar gada yg login dulu atau ada kesalahan nulis script kodenya ya 😅 ?",2,4,1.2.4,2023-12-07 22:26:30,,,1.2.4
1546,116ee547-563b-458c-8975-7100aa78c87d,Adhi Tama,https://play-lh.googleusercontent.com/a-/ALV-UjWrwB3UvE_KnvAOsTnPwjIdQ_tbVTkQtSyr4_RtlfGb6qw5sz4,"Aplikasinya tidak user friendly, berat udah kaya main game gede, interface juga g enak di lihat",1,1,1.2.4,2023-12-07 20:48:02,,,1.2.4
1547,5aaf120e-4706-406d-b835-584617c69bae,imam syafii,https://play-lh.googleusercontent.com/a-/ALV-UjUF6c4df4hiTOEvVjw2iaDRsNhbv9ZBhhMxDSG_YBadOxVZHmQ,"bagus,,",5,0,1.2.3,2023-12-07 17:36:14,,,1.2.3
1548,ed7a05a4-b43d-4c09-9c4f-3238478e53a2,Abdul Muhyi Ali,https://play-lh.googleusercontent.com/a/ACg8ocI_ZAGWz7QomuY69neVQrtlGNHXg2Hnwap05xCoPocfoQa3xNM=mo,aplikasi aneh,1,0,1.2.4,2023-12-07 16:16:34,,,1.2.4
1549,16dcd316-2b5a-4c6d-ac4f-4469e74c507e,Rudi Pratala,https://play-lh.googleusercontent.com/a/ACg8ocJaNfWpOx5vK0vyOZuA8xf6ERqWjxoiUviOMff31glvpmtQCw=mo,"Mau daftar aj susah bnr, dibilang akun sudah terdaftar pula",1,0,1.2.4,2023-12-07 16:14:05,,,1.2.4
1550,5e790041-f9ac-45da-873b-e349b1262f41,Media Enrekang,https://play-lh.googleusercontent.com/a-/ALV-UjVKn41gNeYDjeTdVXzaYnteQ60bFz1AIDV4ENI3_-2XD3ttFfjS,"Apa dananya disedot lagi,. Mau login pake nik/npwp tpi karakternya kurang 1. Ambe semua aja",1,0,1.2.4,2023-12-07 12:42:29,,,1.2.4
1551,0c5d859d-1bf1-4c6a-ab89-03ed1bace29f,Ahmad Fauzi,https://play-lh.googleusercontent.com/a-/ALV-UjU3UoSaSTuPl725DKve2K4fkbOOSoeDBTV5X8wTk_pYRorTNeo,"Kode otp tidak kunjung masuk, sudah 2 jam tidak ada sms juga.",1,0,1.2.4,2023-12-07 12:21:42,,,1.2.4
1552,85e0daf3-dd28-4050-9f2c-34f85b2c6c6c,maulsid,https://play-lh.googleusercontent.com/a-/ALV-UjXpBpC04K_V2ACucJR8pU_sZogckhDSfuPdvI3C71OO13Ff_A3y,Aplikasi pemerintah emang gada yang bener. Makanya kalo ada anggaran buat teknologi jangan korupsi Mulu. Perut di gedein. Percaya aja sama developer gausah banyak protes boomer,1,1,1.2.4,2023-12-07 12:00:57,,,1.2.4
1553,1f95c68c-add3-40ad-8064-3a780080bb40,Zaxiver,https://play-lh.googleusercontent.com/a/ACg8ocKD79cEkFIh10NE0oFQPkvLJqaCl51aLg0rr7lcbh77yl2E_A=mo,KORUPSI TRUSSS....,1,0,,2023-12-07 11:15:58,,,
1554,4e863291-d07c-4f9a-b88b-530c065852d2,Dmitri Fal,https://play-lh.googleusercontent.com/a-/ALV-UjWFUYKqsUAiu0FFzQvVcgHC7mOafgDOErL00LQpXvPrQyXSUWQx,Tidak bisa daftar akun,1,0,1.2.4,2023-12-07 11:04:12,,,1.2.4
1555,707e4753-857d-4df0-a581-1c9f461e1d50,AMF,https://play-lh.googleusercontent.com/a-/ALV-UjUny9L7bF965OWuOxUAKvQPB3ZFqA_0WxRB4BDsr4_Wjn0LyTDn,"Bayar pajak ko ruwet, ka gak jelas, nyusahin orang",1,0,1.2.4,2023-12-07 08:46:37,,,1.2.4
1556,923da07f-60d7-4592-8975-c0bdf5ef24c9,dea docank,https://play-lh.googleusercontent.com/a/ACg8ocJ219wCyGEaZ_PcrCSZ_lF4qooOdYDXkKkmTM7l7TrtcixNKQ=mo,Apk rusak,1,0,1.2.4,2023-12-07 07:57:10,,,1.2.4
1557,664c81d3-a5b5-4275-acd6-836c047386b4,Rama Netto,https://play-lh.googleusercontent.com/a-/ALV-UjUWMZyaE2RQCPnJuLph4fGP_qb6QxtDZrLIEhl29C-AgxYIVDNy,Kenapa force close terus waktu ambil foto diri,1,0,1.2.4,2023-12-06 20:49:22,,,1.2.4
1558,bd586d39-e52d-40b0-a803-005a107bc470,Intep Gosoong,https://play-lh.googleusercontent.com/a-/ALV-UjV8I79xLw3JltyLjEGFLfmEk51oGsJA83O1caLMS6YiqY97AeYU,"Ga bisa login, jumlah digit kurang",1,0,1.2.4,2023-12-06 20:37:39,,,1.2.4
1559,511b3405-0cd1-4c58-be8d-fc589a549dfc,rosyad von,https://play-lh.googleusercontent.com/a-/ALV-UjVo0D1o8h0LbxFah2P2Opd552rnny42WE0Uajc8WjolE6UnD72q,"Zaman dah canggih. Tapi masih aja harus ke kantor. Ngurus ini ngurus itu, baru bisa login. Birokrasi masih nggak bisa hilang tah di negra ini? Hadeeeeh, ini to yg namanya modernisasi dgn kearifan lokal?, sudah digital tapi birokrasi harus tetap ada. 😈",1,0,1.2.4,2023-12-06 10:25:29,,,1.2.4
1560,d9176e04-66cf-4a1a-bd06-f4a81362f2c8,Awang suhawan,https://play-lh.googleusercontent.com/a/ACg8ocKEbZt3DEd3nFlVg1Ff73ZhWlQjtsnrdnr6WS-oU6evcES37Q=mo,Sangat membantu,4,0,1.2.4,2023-12-06 08:04:13,,,1.2.4
1561,a3722216-c5e3-4025-acb3-c44beae4f32b,Ahmad Naufal,https://play-lh.googleusercontent.com/a-/ALV-UjVo_tmVJgvhkVQK7eqAeWV8GnjiFY7URPqTrUfk7-KK7UggDq3Ixw,Aplikasi babi padahal nomor telepon dah bener tapi ga bisa anjg,1,1,1.2.4,2023-12-05 23:44:50,,,1.2.4
1562,5d9c9366-f21c-4b75-b36b-fb2318989c0f,Hendro Parwanto,https://play-lh.googleusercontent.com/a-/ALV-UjV4UFyj1gUA2aJgt71gwsXniuemUZsGD5Ge9tPSDAc81dMtq2ej,Aplikasi nya tidak sesuai dengan yang diharapkan.. Selalu gagal untuk meminta efin,1,0,1.2.4,2023-12-05 15:35:23,,,1.2.4
1563,ca3bfb80-c179-4a5a-a861-629188f74517,Novan Riswanto,https://play-lh.googleusercontent.com/a-/ALV-UjWV0vMe-tLiaqFA128Ec-BTBAq1poCutcP4mqVlpRIxDJKKPfo,Kira kira lah bikin aplikasi tadi vaild..buka lagi engk valid...,3,0,1.2.4,2023-12-05 15:35:03,,,1.2.4
1564,1163e8e3-1e2c-494c-b315-f794130546f5,Neki Supiandi,https://play-lh.googleusercontent.com/a/ACg8ocJ7V2soLiCi7LJPJuaNPT7Y8tcT1W25g-pveh-gUqGQeeHbOw=mo,Mantap,5,0,1.2.4,2023-12-05 15:33:28,,,1.2.4
1565,67d4253c-d9e4-4984-9d4c-28a620cbc5e8,Ry,https://play-lh.googleusercontent.com/a-/ALV-UjVkMognxGJyIQnKT7yCQItgxbevVwYCvCbolv1X4iTjS3qs1N6i,"Aplikasi cuma menampilkan data dan ajakan giat, minim fitur, mohon diperbaiki",1,1,1.2.4,2023-12-05 11:36:37,,,1.2.4
1566,a49b5291-c600-4723-8bca-65c9bfa36367,Fery Kristiawan,https://play-lh.googleusercontent.com/a/ACg8ocK73zciEL8tSzOVQX7Hza1UljEKw7oOOcmD3tP4Vpptex48-A=mo,Aplikasi TOLOL ! Mau masuk aja susah,1,0,1.2.4,2023-12-05 10:56:16,,,1.2.4
1567,d5be177c-4f76-4dd3-b90d-d14508bf8c77,Gtravl Tour,https://play-lh.googleusercontent.com/a-/ALV-UjWkaGi-ZbZBoeBqs3ew2OW04F3S_vfporlCbpdIuNqL-yitU_0P,Sekelas lembaga riba eh pajak masa ga bs buat aplikasi bagus.. heran.. anggarannya lari kemana..??,1,0,,2023-12-05 08:59:13,,,
1568,f3cca083-bef9-402b-b6dc-0b8028cf0682,Muhammad Sofi Latif,https://play-lh.googleusercontent.com/a-/ALV-UjX5-U5de5V7mjLMxStyTiBhu1jVpdtqmcvA1BsKD0-aLJTTIYE,"dua bulan ini ""tombol buat kode billing"" ndak aktif, mau buat kode billing ndak bisa, sebelumnya lancar",3,1,1.2.4,2023-12-05 06:28:33,,,1.2.4
1569,80a0d900-dac3-4d8a-9c52-c48802581752,Cah Ndeso GK,https://play-lh.googleusercontent.com/a-/ALV-UjWMeOIuXNYelHOaAGig6ZEASkpD6LAiFI0NrJakKw3uXsrC_kSm,Ini kode verisikasi efin itu dikirim pakai apa ya? Kok lama bgt ga muncul². Ga pakai pos kan?,1,1,1.2.4,2023-12-05 06:27:11,,,1.2.4
1570,3e4c2601-eebd-45d6-a333-b6557f463858,Feri Kristianto,https://play-lh.googleusercontent.com/a-/ALV-UjUGD37wIiGz4gBt2uSJj7Ve2Y4-YYLoEFBdX4l9rjwygYnAYYUE,Login dengan NIK KTP kolom tidak cukup untuk mengisi nomor NIK KTP,1,0,1.2.4,2023-12-05 00:37:01,,,1.2.4
1571,32ff908b-c9db-49bc-93ee-a49b78eb8c5f,Mandiri Jaya new,https://play-lh.googleusercontent.com/a/ACg8ocLM66aw0JwAmZD6gXJY8NaLXt-X6KPXj0L7uoGXRXOpWhqD2Q=mo,"Setlh update, Nama alamat tdk bisa diisi. Sebelum update, jenis setoran yg gak muncul. Aplikasi jelek banget. Mohon segera diperbaiki.",1,5,1.2.4,2023-12-04 13:54:03,,,1.2.4
1572,ce2d802d-4b20-4bb5-b65f-535ca7a0cc27,Paku Bumi77,https://play-lh.googleusercontent.com/a/ACg8ocKPO_4aW6cO7GKejQVX7Ei1kfLDpP70v246jLVttQAFTGYtK5I=mo,"sangat parah,aplikasi tak bermutu,pelayanan tidak memuaskan,mempersulit masyarakat",1,0,1.2.4,2023-12-04 11:51:40,,,1.2.4
1573,3ac0f486-f896-4e72-9d07-81111b5ec929,Ahmad Rifani,https://play-lh.googleusercontent.com/a/ACg8ocIUWXLOzuk8z1K6kQM03Bh21MABalBx1IqEFrodEJpFGWQLJg=mo,Apps yg asalan saja,1,0,1.2.4,2023-12-04 09:53:01,,,1.2.4
1574,44b7cb34-0c2c-499f-bb5f-ddd949883d28,Zero Requint,https://play-lh.googleusercontent.com/a-/ALV-UjVAp2EuwDD1yUqZcJNaE1XH0UOCs0ZGLI1zBEHspwsupHMjG-ds,"Verifikasi gagal terus pulsa kepotong terus padahal kode otpnya sudah benar tapi gagal terus,kalo ga bisa bikin aplikasi mending gak usah di buat Buang2 anggaran aja",1,5,1.2.4,2023-12-02 19:23:22,,,1.2.4
1575,a6489ecd-5b54-44cc-ac1c-affdbf6cd945,Prima Satriansyah,https://play-lh.googleusercontent.com/a/ACg8ocJskoFasEO2o2QKJ3QDEXpnUE-K2WVZmcKW0dXb5GxBFxZSqA=mo,Aplikasi jembut rontok susah,1,0,1.2.4,2023-12-02 11:56:00,,,1.2.4
1576,0025710a-319f-4b45-ade2-b745705231d7,Mahpud Jamaludin,https://play-lh.googleusercontent.com/a-/ALV-UjUp9xKNoa6MwoiQL8FqeX1fYyMIOBHGuI5aDPk4eh854NiWt0w,"Mending gausah bikin EFIN dah kalau lupa susah banget nyari² si EFIN, lewat apk keterangan gagal ERR_SMSGW, lewat layanan telpon 1500200 coba menghubungi petugasnya ga bisa tersambung sama petugas malah di matiin telpon nya, lewat chat bot website ga bisa yaudahlah caranya biar gampang dateng ke kantor KPP",1,1,1.2.4,2023-12-02 11:39:12,,,1.2.4
1577,3c0c66cd-a84d-4354-a52a-76d008431719,Ferdian Aryandi,https://play-lh.googleusercontent.com/a-/ALV-UjVqJy1f4cm-gD9MPiuogwCrgWGEZn4JrBBhl6hFoyXff3yJrBkK,Minta efin gagal terus apk payah,1,0,1.2.4,2023-12-01 23:25:25,,,1.2.4
1578,8ca23342-cb4e-41fa-83d4-4933869605b6,ariful hidayat,https://play-lh.googleusercontent.com/a-/ALV-UjUT5ceIlgGzxr0CyeKhq5sxQNpGCOzdvg8au6vsVUtBgPQfHopJ,buruk,1,0,1.2.4,2023-12-01 19:29:27,,,1.2.4
1579,6f1c35d5-7e1d-43ff-8062-67362ae146af,Muchammad Zakariyya Virdous,https://play-lh.googleusercontent.com/a/ACg8ocI-Uqt7scYTQcItntQF71mUvYujD50PEpLaz7LYH7Mm830Eiw=mo,Loginya pas pengisian nik/npw angkanya kurang 1 digit jadi gak bisa login,1,0,1.2.4,2023-12-01 17:39:30,,,1.2.4
1580,efc3b417-c56a-406f-be81-542353fafc43,malaikat pencabut nyawa,https://play-lh.googleusercontent.com/a-/ALV-UjUvPy8XPy4d9x5m-oXRLui8sI9_O24PsderllsWAZF1P_9XkHU,"Susah login, verifikasi gagal terus hadehhh",1,0,1.2.4,2023-12-01 12:39:51,,,1.2.4
1581,f45c4886-4548-493c-95f6-9d9f149e24c4,Beriman Dan Berpikir,https://play-lh.googleusercontent.com/a-/ALV-UjVz36_RuyAS9BZmRkfn-1WZKatEKdBCXcZJWeeowu_lCofwBcua,Kurang bisa dimengerti,1,0,,2023-11-30 21:12:43,,,
1582,18ada854-4ee8-4f96-972e-2c384ac34073,M Gani F,https://play-lh.googleusercontent.com/a-/ALV-UjUeGT-808zAGkD9d9yDfZXW7_NEImCRlvw7gPO16Y4RqSs8mTsK,Loh in susah bgt gblok bgt suruh taat pajak tapi ribet,1,0,1.2.4,2023-11-30 19:29:19,,,1.2.4
1583,931bba2b-6105-4f56-bf1f-8e080e1c379f,aisyah lukita,https://play-lh.googleusercontent.com/a-/ALV-UjUQhQamiOJ1h4IL38YWNOHN45ZxSs90KapMvtenyLFjj3Q8-og,"Mau login disuruh isi EFIN. Lupa EFIN disuruh ngisi data diri tapi gagal terus, tertulis gagal mendapat no HP padahal gak ada sama sekali isian no HP. Ribet",1,0,,2023-11-30 16:58:49,,,
1584,623abc61-6211-406b-ac4f-e0c636a7803e,Vendi Setyawan,https://play-lh.googleusercontent.com/a-/ALV-UjX-mBEONHFJ_LzvkRxk2fK9Fg-GO41XiMaLFoaXlgFYCKakg3xd,Aplikasi goblokkkkkk,1,0,1.2.4,2023-11-30 16:57:17,,,1.2.4
1585,4cce4060-a94c-4356-ade7-44027888fc17,Sahid Listrik,https://play-lh.googleusercontent.com/a-/ALV-UjVyhJdlQFHuttOFXU3e7y1aIZVfxhk71KNK7dD0W0r6Em6au18,Good job! :),5,0,1.2.2,2023-11-30 14:12:06,,,1.2.2
1586,3a240013-9d08-4b95-9145-634e32dabdba,Miftah Aminudin,https://play-lh.googleusercontent.com/a-/ALV-UjXPeoPrA648fNu3A8fQZcd-OCYtQ1e4S89zKCnb5srpoza2vAWl,aplikasi anjingg mempersulit kebanyakan erorr monyett,1,0,,2023-11-30 12:16:23,,,
1587,18a30179-af84-4275-8084-9a89282ea613,Purnama Yanti,https://play-lh.googleusercontent.com/a/ACg8ocJ1Yvjhbm2Yk3HKiLPRNvA_YbG0XZMg5cVUCcz8YosYUzEzLQ=mo,aplikasi gk jelas pas daftar malah bilang nik tidak terdaftar didukcapil.aneh gk mungkin tau orang baru berapa bulan lalu urus kk dll smua bisa dasar,1,1,1.2.4,2023-11-29 20:40:45,,,1.2.4
1588,9c923719-9743-4447-afcd-8048e36b1d43,bayu ari setiawan,https://play-lh.googleusercontent.com/a-/ALV-UjVAVe_6l1dO0gOkKUqh3ZUkH6XFzhS4ffYoWjNMsH67q2Aozp8,Udh daftar mau masuk ke akun malah tidak terdaftar malah udh daftar 2x adeh,2,0,1.2.4,2023-11-29 18:48:03,,,1.2.4
1589,33295bf8-f694-4d99-80e7-26e8795e0b24,INDRA PRATAMA,https://play-lh.googleusercontent.com/a-/ALV-UjWEALCZi-C56T1LTJhITiUriUinB7xO4p7iUJ9aMDkyhbyMZBII,Aplikasi sampah!,1,0,1.2.4,2023-11-29 16:02:51,,,1.2.4
1590,4e137a43-3b52-45d4-a91b-35c379d3c74a,Hmm,https://play-lh.googleusercontent.com/a-/ALV-UjVXbT84i3c36AgLeCKol4f8CT7PyHGzPKojPywDOdhD_zvZBns,Bukannya benerin web malah bikin aplikasi,1,0,,2023-11-29 14:50:34,,,
1591,cb632811-991c-4585-ba21-200568cc98b5,Yogyan Sadewa,https://play-lh.googleusercontent.com/a-/ALV-UjUKq-H6NyLN2WEroMKFmjE7N8iK3z9bWxj933Q-iiWypY0M4-c,Buat login pakai NIK tidak bisa. Kolom pengisian kurang/tidak di izinkan.,1,0,1.2.4,2023-11-29 14:10:01,,,1.2.4
1592,343c129f-e4e2-40fd-a181-439066e82b07,Asrul RMD OFFICIAL,https://play-lh.googleusercontent.com/a-/ALV-UjVN7TzNuHYE43iAS6qDQSdytAnAactSabEKZGW4s5K3Q4o3T65c,"Aplikasi yg mempersulit masyarakat,,maunya terima uang pajak aja,tapi kita mau login begitu di persulit,,aku masukin nomer mpwp malah gak ditemukan,,",1,5,1.2.4,2023-11-29 12:08:50,,,1.2.4
1593,5809c558-2e23-43f2-b7bd-29b2a7348a29,Wahyu adi Prasetya,https://play-lh.googleusercontent.com/a/ACg8ocLUYFwYN6GmL2dKAm3B3dDID7ZPj34jo3XyMSknDjsF3n217Q=mo,"Tidak bisa masuk karena lupa efin di tlpn ke cs minta d bantu malah lempar sana sini, pelayanan nya sangat buruk!",1,0,1.2.4,2023-11-29 10:06:39,,,1.2.4
1594,cac8764c-1079-404c-bc27-a42dafd1b9ec,Sudahtau Tau,https://play-lh.googleusercontent.com/a/ACg8ocI3TuaIkDhEHyapktBDE726t5022iZMO-hFKjQE5f-wbUg1xA=mo,Cabca tidak cocok terus. Kacau aplikasi djp 😇,1,0,,2023-11-29 09:35:03,,,
1595,f7b40634-9e3a-42c6-9bf6-e8666d70cc5e,Adi Subakti,https://play-lh.googleusercontent.com/a/ACg8ocKiCC1QUYY9MJy5PhBrr98eo73QTrJIVZa3U80K0ht5jB2pjg=mo,Apk bodoh,1,0,1.2.4,2023-11-28 19:07:48,,,1.2.4
1596,0604406c-ca36-4e2b-9970-a605cbbd5a34,Diva Nagara,https://play-lh.googleusercontent.com/a/ACg8ocJXoztR5yb-MwRjM80nsEc6erW4gkJs0U4pqYEibjzSbQ8oVQ=mo,"jangan mempersulit untuk apa ada digital online kalau harus ke kantor pajak,tinggal merubah no npwp ke no nik ktp aja susah banget.data sudah lengkap",1,1,1.2.4,2023-11-28 10:48:15,,,1.2.4
1597,9d3cf2a2-1bcb-4d49-ab38-9f1e443ea8d6,old boy,https://play-lh.googleusercontent.com/a/ACg8ocLjF66yNxOrNKKpnf2eI4JiMVQRSnU2sqdzFx1MObAZf3vRbQ=mo,"buruk,pengen liat efin sama login aja susah dipersulit kok gini banget",1,0,,2023-11-28 10:44:54,,,
1598,f4e11d51-d31a-42b9-b54f-a58f13bb02a8,Rachmad Zidan,https://play-lh.googleusercontent.com/a/ACg8ocIXdOjiOYxY69oHa-hHLcOnD09zZk7lGtyKfRtyyXD9Gd2taA=mo,Gagal terus buat EFIN,1,0,1.2.4,2023-11-28 10:04:17,,,1.2.4
1599,7d1c3807-bd0b-4949-b918-2beb4addccc0,Sandi Sanjaya,https://play-lh.googleusercontent.com/a-/ALV-UjU-NHPm_O5MOuccH_v7NHAcOOkb625rd9U9vk9L8NLKFuJsK4SP,Aplikasi dangak2...,1,0,,2023-11-28 08:31:22,,,
1600,1bd7df63-4b2a-4422-aaaa-7c39077d67ea,RAF,https://play-lh.googleusercontent.com/a/ACg8ocKKSBBlNkD-ax_0m2eH8GD9n5eILqUb-DyVdpgRfTBTEV0TpAo=mo,Minimal mobile appnya dikembangin dulu sebelum ngerepotin rakyat,1,0,1.2.4,2023-11-28 07:51:41,,,1.2.4
1601,0b3fcbab-f428-41f9-afe6-e2372147f031,Cindy Octaviani,https://play-lh.googleusercontent.com/a-/ALV-UjV29ycdhaQ4nv1pdZDKu1tNoPlKCaMMyWvEpvkbZQzO0H0skwoYOQ,"Kenapa ketika mau mengajukan lupa efin di aplikasi, aplikasinya selalu keluar sendiri? Tolong bantuannya",2,0,1.2.4,2023-11-28 06:29:40,,,1.2.4
1602,d309842a-0c53-4922-a118-ef948b62d363,M. MUSLIM,https://play-lh.googleusercontent.com/a-/ALV-UjU5uCUqSv2a9cgUxpUCGkyn0YBEN7hPg0xcwNQl_KQxvyRMDFLC,Ampas.,1,0,,2023-11-28 00:01:24,,,
1603,f07a9b69-7990-4991-8fed-49d05131744c,Paulus Seran,https://play-lh.googleusercontent.com/a-/ALV-UjUHWyxElhELDI9SUm5sbFpr4GyloPvv44H_gBgjQ1is-I0GuEE,"Sangat tidak bermanfaat, karena tidak berguna untuk pendaftaran orang pribadi. Harus ke kantor pajak. Apa gunanya aplikasi online? Harusnya memudahkan bagi yang punya inisiatif untuk membuat atau memiliki NPWP pribadi dan bisa bayar pajak. Bagaimana mau bayar pajak, secara pribadi tidak punya NPWP?",1,13,1.2.4,2023-11-27 22:50:24,,,1.2.4
